Company/Brand,Year1,Revenue1,Year2,Revenue2,Year3,Revenue3,Year4,Revenue4,Year5,Revenue5,HQ,Sector,Founders,Investor,Amount($),Stage,What it does,,,,,,,,,,,,,,,DaMENSCH,2020,42000000,2021,30000000,2022,12000000,2023,36000000,NA,NA,Gurugram,E-commerce,"Anurag Saboo, Gaurav Pushkar","Whiteboard Capital, Matrix Partners India",6000000,,DaMENSCH is a designer and seller of men's apparel.,,,,,,,,,,,,,,,Country Delight,2020,175000000,2021,125000000,2022,50000000,2023,150000000,NA,NA,Mumbai,Food & Beverages,"Chakradhar Gade, Nitin Kaushal","Orios Venture Partners, Matrix Partners India",25000000,Series C,Country Delight produces and distributes milk intended to provide good quality and unadulterated milk at doorstep.,,,,,,,,,,,,,,,SignalX,2020,5600000,2021,4000000,2022,1600000,2023,4800000,NA,NA,New Delhi,Artificial Intelligence,"Govind Balachandran, Zakir Wahab, Piyush Arora","9Unicorns, 3Lines VC, Hyderabad Angels",800000,Seed,SignalX offers an artificial intelligence-powered SaaS platform,,,,,,,,,,,,,,,Lancify,2020,2100000,2021,1500000,2022,600000,2023,1800000,NA,NA,Mumbai,EdtTech,"Gowtham Sundaresan, Azan Barodawala","Techstars, Techstars Bangalore Accelerator",300000,,Lancify is building the world's strongest young workforce,,,,,,,,,,,,,,,Krimanshi,2020,4200000,2021,3000000,2022,1200000,2023,3600000,NA,NA,Bangalore,Biotechnology,Nikhil Bohra,"Rajasthan Venture Capital Fund, AIM Smart City",600000,Seed,Krimanshi aims to increase rural income by improving the productivity of Indian cattle with better quality feed.,,,,,,,,,,,,,,,Instoried,2020,7000000,2021,5000000,2022,2000000,2023,6000000,NA,NA,Satara,Artificial Intelligence,"Sharmin Ali, Sutanshu Raj","Venture Catalysts, SOSV",1000000,Pre-series A,Instoried is an augmented writing platform which improves customer interest and engagement.,,,,,,,,,,,,,,,PlayerzPot,2020,21000000,2021,15000000,2022,6000000,2023,18000000,NA,NA,Mumbai,Gaming,"Yogesh, Mitesh Gangar",,3000000,Series A,"Favorite fantasy cricket, football & kabaddi leagues online to win daily cash and prizes",,,,,,,,,,,,,,,Turtlemint,2020,210000000,2021,150000000,2022,60000000,2023,180000000,NA,NA,Bangalore,Health Care,"Anand Prabhudesai, Dhirendra Mahyavanshi, Kunal Shah","Nexus Venture Partners, Dream Incubator",30000000,,Turtlemint has built Indian personalized insurance platform,,,,,,,,,,,,,,,Arata,2020,7000000,2021,5000000,2022,2000000,2023,6000000,NA,NA,Ahmadabad,E-commerce,"Dhruv Madhok, Dhruv Bhasin",DSG Consumer Partners,1000000,Pre-series A,Arata is an e-commerce site for beauty products and cosmetics.,,,,,,,,,,,,,,,MPL,2020,35000000,2021,25000000,2022,10000000,2023,30000000,NA,NA,Orissia,Gaming,"Sai Srinivas Kiran G, Shubham Malhotra","Pegasus Tech Ventures, Base Partners",5000000,,Mobile Premier League is a skill-based eSports platform used to offer cash prizes while playing games.,,,,,,,,,,,,,,,True Balance,2020,196000000,2021,140000000,2022,56000000,2023,168000000,NA,NA,Bangalore,Fintech,"Cheolwon Lee, Jay Yi, Martin Lee","IBK Capital, SB Partners",28000000,,True Balance is a digital wallet that enables users to access utility bill payment and other financial products.,,,,,,,,,,,,,,,Prescribe,2020,700000,2021,500000,2022,200000,2023,600000,NA,NA,New Delhi,Health Care,Nived Narayanan,Titan Capital,100000,,Provide online services to patients by leveraging WhatsApp.,,,,,,,,,,,,,,,Nepra,2020,126000000,2021,90000000,2022,36000000,2023,108000000,NA,NA,Bangalore,Cleantech,Sandeep Patel,"Asha Impact, Aavishkaar Venture Capital",18000000,Series C,NEPRA Resource Management provides waste management solutions in India.,,,,,,,,,,,,,,,inFeedo,2020,22400000,2021,16000000,2022,6400000,2023,19200000,NA,NA,Mumbai,SaaS,Tanmaya Jain,"Peyush Bansal, Ritesh Malik",3200000,,"inFeedo is a predictive people analytics company helping 300,000+ employees in 100+ companies make their voice feel heard and valued.",,,,,,,,,,,,,,,MindTickle,2020,700000000,2021,500000000,2022,200000000,2023,600000000,NA,NA,Mumbai,SaaS,"Deepak Diwakar, Krishna Depura, Mohit Garg, Nishant Mungali","Canaan Partners, NewView Capital",100000000,Debt,MindTickle offers the industry's most comprehensive sales readiness solution for closing knowledge and skill gaps in customer-facing teams.,,,,,,,,,,,,,,,Krimanshi,2020,4200000,2021,3000000,2022,1200000,2023,3600000,NA,NA,Mumbai,Biotechnology,Nikhil Bohra,"Rajasthan Venture Capital Fund, AIM Smart City",600000,Seed,Krimanshi aims to increase rural income by improving the productivity of Indian cattle with better quality feed.,,,,,,,,,,,,,,,Slice,2020,35000000,2021,25000000,2022,10000000,2023,30000000,NA,NA,Jaipur,Fintech,"Deepak Malhotra, Rajan Bajaj","Better Capital, Gunosy",5000000,Debt,Slice is a card for first-time credit card users. They are inventing the future of finance for young Indians,,,,,,,,,,,,,,,Rapawalk,2020,2100000,2021,1500000,2022,600000,2023,1800000,NA,NA,Chandigarh,E-commerce,"Kashif Mohammad, Aravind Maddireddy","Sanjay Ramakrishnan, Ravi Garikipati",300000,Seed,Rapawalk is an online brand that offers a personalized service of creating your own shoes.,,,,,,,,,,,,,,,Stride Ventures,2020,560000000,2021,400000000,2022,160000000,2023,480000000,NA,NA,Bangalore,Venture capitalist,Ishpreet Gandhi,Small Industries Development Bank of India,80000000,,Stride Ventures is a venture capital firm in India which aims to invest in innovative startups across the country.,,,,,,,,,,,,,,,BlackSoil,2020,70000000,2021,50000000,2022,20000000,2023,60000000,NA,NA,Chennai,Fintech,Ankur Bansal,,10000000,,Blacksoil Advisory is an independent boutique advisory firm.,,,,,,,,,,,,,,,Biocon,2020,105000000,2021,75000000,2022,30000000,2023,90000000,NA,NA,Mumbai,Health Care,Kiran Mazumdar-Shaw,Goldman Sachs,15000000,,"Biocon is a healthcare and technology, company focused on biotechnology.",,,,,,,,,,,,,,,Clientjoy,2020,5600000,2021,4000000,2022,1600000,2023,4800000,NA,NA,Bangalore,SaaS,"Abhishek Doshi, Anupama Panchal, Shashwat Bhatt, Yash Shah","LetsVenture, Jyotsna Bapat",800000,Pre-series A,Client Management Software For Modern Agencies.,,,,,,,,,,,,,,,Xpressbees,2020,700000000,2021,500000000,2022,200000000,2023,600000000,NA,NA,Jodhpur,E-commerce,"Amitava Saha, Supam Maheshwari","Alibaba Group, InnoVen Capital",100000000,,Xpressbees is an e-commerce logistics company that provides reliable logistics solutions to its partners.,,,,,,,,,,,,,,,Wellness Forever,2020,700000000,2021,500000000,2022,200000000,2023,600000000,NA,NA,Bangalore,Health Care,"Ashraf Biran, Gulshan Bakhtiani, Mohan Chavan","Poonawalla, Allana Group",100000000,,Wellness Forever is the one-stop destination for wellness,,,,,,,,,,,,,,,MoooFarm,2020,3500000,2021,2500000,2022,1000000,2023,3000000,NA,NA,Bangalore,AgriTech,"Param Singh, Aashna Singh, Abhijeet Mittal, Jitesh Arora","Navus Ventures, Rockstart",500000,Pre-seed,MoooFarm is an information technology company that bridges the technology gap to help marginalized dairy farmers.,,,,,,,,,,,,,,,Gonuts,2020,2800000,2021,2000000,2022,800000,2023,2400000,NA,NA,Pune,Entertainment,"Vinamra Pandiya, Mayank Gupta, Joji George","Sweta Rau, Archana Priyadarshini",400000,Seed,Personalised Video shoutouts from favourite celebrity.,,,,,,,,,,,,,,,Uolo,2020,14000000,2021,10000000,2022,4000000,2023,12000000,NA,NA,Bangalore,EdtTech,"Pallav Pandey, Ankur Pandey, Siddharth Singh","Rajul Garg, Purvi Capital",2000000,Seed,Uolo Technology is founded by paranoid parents who want to make a difference to preschool experience.,,,,,,,,,,,,,,,Kirana King,2020,6300000,2021,4500000,2022,1800000,2023,5400000,NA,NA,Noida,Retail,Anup Kumar,Rajasthan Venture Capital Fund,900000,Pre-series A,"A revolutionary idea of standardization, digitization & centralization to traditional Grocery system.",,,,,,,,,,,,,,,Jade Forest,2020,1750000,2021,1250000,2022,500000,2023,1500000,NA,NA,Pune,Food & Beverages,"Punweet Singh, Shuchir Suri",,250000,Seed,"NATURALLY THE BEST From zero artificial ingredients in our drinks to the way they make you feel, we bring you a bespoke range of natural mixers.",,,,,,,,,,,,,,,FrontRow,2020,22400000,2021,16000000,2022,6400000,2023,19200000,NA,NA,Mumbai,EdtTech,"Mikhil Raj, Shubhadit Sharma, Ishaan Preet Singh","Lightspeed, Elevation, Deepika Padukone",3200000,Seed,"Comprehensive courses, taught by idols.",,,,,,,,,,,,,,,Reliance Retail,2020,70000000,2021,50000000,2022,20000000,2023,60000000,NA,NA,Mumbai,E-commerce,Mukesh Ambani,"Abu Dhabi Investment Authority, GIC",10000000,,Reliance Retail Ventures Limited is a subsidiary company of Reliance Industries Limited.,,,,,,,,,,,,,,,Ather Energy,2020,245000000,2021,175000000,2022,70000000,2023,210000000,NA,NA,Bangalore,Electric Vehicle,"Arun Vinayak, Swapnil Jain, Tarun Mehta",HeroMotoCorp Ltd and Sachin Bansal,35000000,Series D,Ather Energy is a manufacturer of electric scooters.,,,,,,,,,,,,,,,Routematic,2020,14000000,2021,10000000,2022,4000000,2023,12000000,NA,NA,Mumbai,SaaS,"Sriram Kannan, Surajit Das","VAMM Ventures, Naresh Malhotra",2000000,,Vision is to enable a safer and more comfortable commute to work for employees of India Inc.,,,,,,,,,,,,,,,LivFin,2020,32900000,2021,23500000,2022,9400000,2023,28200000,NA,NA,New Delhi,Fintech,Rakesh Malhotra,"DEG, KFW DEG",4700000,,LivFin is a non-banking financial company registered with the Reserve Bank of India (RBI),,,,,,,,,,,,,,,Eggoz,2020,10500000,2021,7500000,2022,3000000,2023,9000000,NA,NA,Bangalore,Food & Beverages,"Abhishek Negi, Aditya Singh, Pankaj Pandey, Uttam Kumar","AVANA Capital, Rebright Partners",1500000,Pre-series A,"Eggoz is a brand of fresh and chemical-free eggs, produced in tech-enabled & nutrition-engineered deep integration partnership with farmers.",,,,,,,,,,,,,,,CHARGE+ZONE,2020,21000000,2021,15000000,2022,6000000,2023,18000000,NA,NA,Bangalore,Electric Vehicle,"Kartikey Hariyani, Pavan Bakeri",Mumbai Angels,3000000,Pre-series A,"Charge+Zone provides services in renewable energy solutions, product development, and software engineering company.",,,,,,,,,,,,,,,Stones2milestones,2020,14000000,2021,10000000,2022,4000000,2023,12000000,NA,NA,Gurugram,EdtTech,"Kavish Gadia, Nikhil Saraf","Menterra Venture Advisors, Emandi Sankara Rao",2000000,Bridge,Stones2milestones is India (Delhi) Based EdTech Company,,,,,,,,,,,,,,,Udacity,2020,525000000,2021,375000000,2022,150000000,2023,450000000,NA,NA,Bangalore,EdtTech,"David Stavens, Mike Sokolsky, Sebastian Thrun","Hercules Capital, Inc.Bertelsmann",75000000,Debt,"Udacity develops an online learning platform offering programs in artificial intelligence, machine learning, and robotics sector.",,,,,,,,,,,,,,,AjnaLens,2020,7000000,2021,5000000,2022,2000000,2023,6000000,NA,NA,Bangalore,AR/VR,"Abhijit Patil, Abhishek Tomar, Pankaj Raut","Mohsin Hani Al Bahrani, MoD",1000000,Bridge,"AjnaLens develops AR/VR wearables primarily for the Defence, Education and enterprise customers.",,,,,,,,,,,,,,,Gully Network,2020,8400000,2021,6000000,2022,2400000,2023,7200000,NA,NA,Mumbai,E-commerce,"Ajay Nain, Prateek Chaturvedi","CP Ventures, Orios Venture Partners",1200000,Pre-series A,Gully Network is a tech-enabled network of mid-sized grocery stores.,,,,,,,,,,,,,,,Svami,2020,5600000,2021,4000000,2022,1600000,2023,4800000,NA,NA,Mumbai,Food & Beverages,Sahil Jatana,"Niren Shah, Rukam Capital Trust",800000,,Svami is the result of three seasoned drinkers extending their love for libations to the larger world of drinks.,,,,,,,,,,,,,,,Dhurnia,2020,700000,2021,500000,2022,200000,2023,600000,NA,NA,Bangalore,EdtTech,"Ajay Kumar, Murari Singh","Chandigarh Angels Network, Modulor Capital",100000,,Developer of an online learning platform intended for various competitive exam preparations.,,,,,,,,,,,,,,,Leena AI,2020,56000000,2021,40000000,2022,16000000,2023,48000000,NA,NA,New Delhi,Artificial Intelligence,"Adit Jain, Anand Prajapati, Mayank Goyal","Alan Patricof, Jim Moffatt",8000000,,Leena AI offers a human resource management platform that transforms employee experience with conversational AI.,,,,,,,,,,,,,,,Bizlog,2020,7000000,2021,5000000,2022,2000000,2023,6000000,NA,NA,Pune,Logistics & Supply Chain,"HS Srinivasan, Krishnan Rajan, E.V. Shunmugam",IAN Fund,1000000,,Bizlog Value Chain enables re-commerce and circular economy through unique REVERSE LOGISTICS engine.,,,,,,,,,,,,,,,Tamasha.live,2020,2100000,2021,1500000,2022,600000,2023,1800000,NA,NA,Mumbai,Gaming,"Saurabh Gupta, Siddharth Swarnkar","9Unicorns, Titan Capital, FirstCheque",300000,,"Tamasha offers a platform for influencers to host live, video based, real money contests and games.",,,,,,,,,,,,,,,Fedo,2020,7000000,2021,5000000,2022,2000000,2023,6000000,NA,NA,Bangalore,Artificial Intelligence,"Arun Mallavarapu, Prasanth Madavana",AIM Smart City,1000000,,Artificial Intelligence based Credit Score for Health,,,,,,,,,,,,,,,FabHotels,2020,7000000,2021,5000000,2022,2000000,2023,6000000,NA,NA,Mumbai,Hospitality,"Adarsh Manpuria, Vaibhav Aggarwal","RB Investments Pte. Ltd, Goldman Sachs",1000000,,Fabhotels is the online aggregator for hotel rooms. It aims to provide standardized services at economical budgets.,,,,,,,,,,,,,,,Freshokartz,2020,7000000,2021,5000000,2022,2000000,2023,6000000,NA,NA,New Delhi,AgriTech,"Chandrakanta, Rajendra Lora","Rajasthan Venture Capital Fund, Innovana Thinklabs",1000000,Pre-series A,"Freshokartz provides soil data based crop and fertilisers recommendation to farmers and delivery seeds, pesticides",,,,,,,,,,,,,,,FlexiLoans,2020,42000000,2021,30000000,2022,12000000,2023,36000000,NA,NA,Hyderabad,Fintech,"Abhishek Kothari, Deepak Jain, Manish Lunia, Ritesh Jain",>Vikram Sud,6000000,Debt,"an online lending platform started with an endeavour to solve the problem that SMEs face in accessing Quick, Flexible and Adequate funds for growing their Businesses.",,,,,,,,,,,,,,,FreshtoHome,2020,847000000,2021,605000000,2022,242000000,2023,726000000,NA,NA,New Delhi,E-commerce,Shan Kadavil,"Ascent Capital, Iron Pillar",121000000,Series C,Freshtohome is an e-commerce platform for fresh and chemical-free seafood.,,,,,,,,,,,,,,,Credable,2020,31500000,2021,22500000,2022,9000000,2023,27000000,NA,NA,Noida,Fintech,Nirav Choksi,Oaks Asset Management,4500000,,CredAble provides working capital & supply chain finance programs for large enterprises and their suppliers and distributors.,,,,,,,,,,,,,,,Railofy,2020,35000000,2021,25000000,2022,10000000,2023,30000000,NA,NA,Bangalore,Transportation,"Rohan Dedhia, Vaibhav Saraf, Hrishabh Sanghvi","Roots Ventures, Better Capital",5000000,Seed,Railofy is a WL & RAC protection that enables waitlisted passengers to reach their destination at the lowest possible price.,,,,,,,,,,,,,,,Finova Capital,2020,385000000,2021,275000000,2022,110000000,2023,330000000,NA,NA,Bangalore,Fintech,"Mohit Sahney, Sunita Sahney","Sequoia Capital India, Faering Capital",55000000,,Finova Capital is a non-banking financial company.,,,,,,,,,,,,,,,Teachmint,2020,24500000,2021,17500000,2022,7000000,2023,21000000,NA,NA,Pune,EdtTech,"Mihir, Payoj Jain, Divyansh Bordia, Anshuman Kumar",Lightspeed India,3500000,Seed,Teachmint is an easy to use platform for tutors to conduct unlimited live classes and manage their classrooms,,,,,,,,,,,,,,,Peel-Works,2020,21000000,2021,15000000,2022,6000000,2023,18000000,NA,NA,Surat,E-commerce,"Sachin Chhabra, Nidhi Ramachandran","CESC Ventures, Brun Raschle",3000000,,Peel-Works is a tech and data analytics company specializing in e-commerce for corner stores.,,,,,,,,,,,,,,,Credgenics,2020,23100000,2021,16500000,2022,6600000,2023,19800000,NA,NA,Lucknow,Fintech,"Anand Agrawal, Mayank Khera, Rishabh Goel","Accel, Sunder Nookala",3300000,Seed,"Credgenics is a tech-enabled platform backed by Titan Capital, helping fintech lenders and Banks in their critical NPA reduction",,,,,,,,,,,,,,,Jumbotail,2020,77000000,2021,55000000,2022,22000000,2023,66000000,NA,NA,Ahmedabad,E-commerce,"Ashish Jhina, Karthik Venkateswaran",Nexus Venture Partners and 23 High Networth Individuals (HNIs),11000000,Series B2,"Jumbotail is solving an important problem of organising food and grocery ecosystem in India through technology, data science and design.",,,,,,,,,,,,,,,Winzo,2020,14000000,2021,10000000,2022,4000000,2023,12000000,NA,NA,Gurugram,Gaming,"Paavan Nanda, Saumya Singh Rathore","Makers Fund, Courtside Ventures",2000000,,WinZO is a mobile e-sports social gaming platform that offers monetary benefits and prizes to players.,,,,,,,,,,,,,,,mCaffeine,2020,35000000,2021,25000000,2022,10000000,2023,30000000,NA,NA,Bangalore,Cosmetics,"Tarun Sharma, Vikas Lachhwani","RPSG Ventures, Amicus Capital",5000000,Series B,"MCaffeine is a personal care brand that offers caffein-infused face, body, and hair care products.",,,,,,,,,,,,,,,FreshtoHome,2020,112000000,2021,80000000,2022,32000000,2023,96000000,NA,NA,Chennai,E-commerce,Shan Kadavil,"Ascent Capital, Iron Pillar",16000000,,Freshtohome is an e-commerce platform for fresh and chemical-free seafood.,,,,,,,,,,,,,,,Jumbotail,2020,77000000,2021,55000000,2022,22000000,2023,66000000,NA,NA,Bangalore,Retail,"Ashish Jhina, Karthik Venkateswaran","Nexus Venture Partners, Capria Ventures",11000000,Series B2,Jumbotail is solving an important problem of organising food and grocery ecosystem in India,,,,,,,,,,,,,,,Genius Teacher,2020,14000000,2021,10000000,2022,4000000,2023,12000000,NA,NA,Bangalore,EdtTech,"Advitiya Sharma, Gaurav Lahoti","Sandeep Tandon, Daniel Lapus",2000000,,"Genius Teacher creates engaging educational content, delivers fun learning experience to the students",,,,,,,,,,,,,,,Krimanshi Feeds,2020,3500000,2021,2500000,2022,1000000,2023,3000000,NA,NA,Bangalore,Nutrition,Nikhil Bohra,"Rajasthan Venture Capital Fund, AIM Smart City",500000,,Krimanshi aims to increase rural income by improving the productivity of Indian cattle with better quality feed.,,,,,,,,,,,,,,,Origo,2020,28000000,2021,20000000,2022,8000000,2023,24000000,NA,NA,Mumbai,AgriTech,"Sunoor Kaul,",Northern Arc Capital,4000000,Debt,Provider of marketing and warehousing services for agricultural commodities.,,,,,,,,,,,,,,,GetVantage,2020,35000000,2021,25000000,2022,10000000,2023,30000000,NA,NA,New Delhi,Fintech,"Amit Srivastava, Bhavik Vasa, Sachin Tagra, Sachin Tagra","Samyakth Capital, Venture Catalysts",5000000,Seed,GetVantage is India and Southeast Asia's first fintech enabled Revenue-based financing platform.,,,,,,,,,,,,,,,Betterplace,2020,70000000,2021,50000000,2022,20000000,2023,60000000,NA,NA,Bangalore,Technology,"Saurabh Tandan, Pravin Agarwala",Jungle Ventures,10000000,Series B,Developer of a digital verification platform designed to manage the semi-formal workforce.,,,,,,,,,,,,,,,Biddano,2020,4200000,2021,3000000,2022,1200000,2023,3600000,NA,NA,Gurugram,Health Care,Talha Shaikh,Windrose Capital,600000,Pre-series A,India's 1st tech-enabled healthcare logistics platform.,,,,,,,,,,,,,,,Hubilo,2020,31500000,2021,22500000,2022,9000000,2023,27000000,NA,NA,Santra,Technology,"Mayank Agarwal, Vaibhav Jain","Nishant Rao, Jonathan Boutelle",4500000,Seed,World?s smartest virtual event platform that brings Experience & Intelligence together,,,,,,,,,,,,,,,BASIC Home Loan,2020,35000000,2021,25000000,2022,10000000,2023,30000000,NA,NA,Bangalore,Fintech,Atul Monga,Picus Capital,5000000,Seed,"A platform for automating home loans for middle and low-income households in India,",,,,,,,,,,,,,,,Ketos,2020,126000000,2021,90000000,2022,36000000,2023,108000000,NA,NA,Mumbai,Artificial Intelligence,Meena Sankaran,"Citi Ventures, Illuminated Funds Group",18000000,,KETOS provides hardware and software analytics solutions and real-time data for usage and flow across water systems.,,,,,,,,,,,,,,,SUGAR cosmetics,2020,14000000,2021,10000000,2022,4000000,2023,12000000,NA,NA,Trivandrum,Cosmetics,"Kasuhik Mukherjee, Vineeta Singh","A91 Partners, RB Investments Pte. Ltd",2000000,Debt,It is a cruelty-free makeup brand providing cosmetics that is high on style and higher on performance.,,,,,,,,,,,,,,,Signzy,2020,37800000,2021,27000000,2022,10800000,2023,32400000,NA,NA,Bangalore,Fintech,"Ankit Ratan, Ankur Pandey, Arpit Ratan","GenNext Ventures, Contrarian Drishti Partners",5400000,,It is creating 'building blocks for a Digital Trust system.,,,,,,,,,,,,,,,Tekion,2020,1050000000,2021,750000000,2022,300000000,2023,900000000,NA,NA,Gurugram,Artificial Intelligence,"Guru Sankararaman, Jay Vijayan","Alliance Ventures, Storm Ventures",150000000,Series C,It is a cloud-built platform with advanced machine learning and AI capabilities for a personalized and seamless consumer experience.,,,,,,,,,,,,,,,Brighteye Ventures,2020,37800000,2021,27000000,2022,10800000,2023,32400000,NA,NA,Ahmedabad,EdtTech,David guerin,Tandem,5400000,,Education technology venture capital firm.,,,,,,,,,,,,,,,EzeRx,2020,1400000,2021,1000000,2022,400000,2023,1200000,NA,NA,Jaipur,Pharmacy,"Amit mandahar, Chaitali roy","Indian Oil Corporation, Krishna Chakravarty",200000,Seed,Developer and manufacturer of medical devices,,,,,,,,,,,,,,,VitalTech,2020,21000000,2021,15000000,2022,6000000,2023,18000000,NA,NA,Bangalore,Health Care,Anjan Panneer Selvam,Tech Mahindra,3000000,Seed,"VitalTech is a develop technologies that empower patients to better care for their safety,",,,,,,,,,,,,,,,Genius Teacher,2020,14000000,2021,10000000,2022,4000000,2023,12000000,NA,NA,Pune,EdtTech,"Advitiya Sharma, Gaurav Lahoti","Whiteboard Capital, VKG Ventures LLP.",2000000,,"Genius Teacher creates engaging educational content, delivers fun learning experience to the students",,,,,,,,,,,,,,,Ultraviolette Automotive,2020,28000000,2021,20000000,2022,8000000,2023,24000000,NA,NA,Gurugram,Electric Vehicle,"Narayan Subramaniam, Niraj Rajmohan",TVS Motor Company,4000000,Series B,Ultraviolette Automotive is a technology startup working on electric two-wheelers and energy infrastructure.,,,,,,,,,,,,,,,GoodGamer,2020,17500000,2021,12500000,2022,5000000,2023,15000000,NA,NA,Hyderabad,Gaming,Charles Creighton,,2500000,Seed,GoodGamer is India's first Daily Fantasy Sports and true Esports gaming platform.,,,,,,,,,,,,,,,InnAccel,2020,10500000,2021,7500000,2022,3000000,2023,9000000,NA,NA,New Delhi,Pharmacy,Siraj Dhanani,Mount Judi Ventures,1500000,Pre-series A,"A building a portfolio of novel medical devices designed, engineered, and priced for global Emerging Markets.",,,,,,,,,,,,,,,Tiliter,2020,52500000,2021,37500000,2022,15000000,2023,45000000,NA,NA,Gurugram,Retail,"Chris Sampson, Marcel Herz, Martin Karafilis","AngelList, Investec",7500000,,Software that uses computer vision to recognise products without barcodes,,,,,,,,,,,,,,,Slintel,2020,29400000,2021,21000000,2022,8400000,2023,25200000,NA,NA,Bangalore,Marketplace,"Deepak Anchala, Rahul Bhattacharya, Ranjana TN","Accel, Stellaris Venture Partners",4200000,,"Slintel, a leader in capturing technographics-powered buying intent, helps companies uncover the 3% of active buyers in their target market.",,,,,,,,,,,,,,,SoOLEGAL,2020,28000000,2021,20000000,2022,8000000,2023,24000000,NA,NA,New Delhi,Legal Services,Manish Kaul,,4000000,,"SoOLEGAL is a global integrated directory of lawyers, legal aid organizations, and Law firms.",,,,,,,,,,,,,,,HobSpace,2020,1400000,2021,1000000,2022,400000,2023,1200000,NA,NA,Bangalore,EdtTech,"Priya Goel Sheth, Harsh Jain",Artha Venture,200000,Seed,India's Activity Hub for Kids,,,,,,,,,,,,,,,Supplynote,2020,3500000,2021,2500000,2022,1000000,2023,3000000,NA,NA,Gurugram,SaaS,"Abhishek Verma, Harshit Mittal, Kumar Kushang, Nitin Prakash","MOX, SOSV",500000,Seed,Supplynote is India's leading procurement platform with a unique stack of SAAS and E-commerce to solve the procurement problem,,,,,,,,,,,,,,,ShopUp,2020,154000000,2021,110000000,2022,44000000,2023,132000000,NA,NA,Bangalore,E-commerce,"Afeef Zaman, Ataur Rahim Chowdhury, Siffat Sarwar","Flourish Ventures, Lonsdale Capital",22000000,Series A,"ShopUp provides easy access to B2B sourcing, last-mile logistics, digital credit, and business management solutions to small businesses.",,,,,,,,,,,,,,,Zomato,2020,364000000,2021,260000000,2022,104000000,2023,312000000,NA,NA,Bangalore,FoodTech,"Deepinder Goyal, Gaurav Gupta, Pankaj Chaddah","Kora, Tiger Global Management",52000000,,Zomato is a food delivery and restaurant discovery site that provides information and reviews about restaurants.,,,,,,,,,,,,,,,Dukaan,2020,42000000,2021,30000000,2022,12000000,2023,36000000,NA,NA,Bangalore,Technology,"Subhash Choudhary, Suumit Shah","Lightspeed, Matrix Partners.",6000000,Seed,Developer of an android application designed for businesses to sell online.,,,,,,,,,,,,,,,CredR,2020,14000000,2021,10000000,2022,4000000,2023,12000000,NA,NA,Gurugram,Marketplace,"Nikhil Jain, Nittin Mittal, Sumit Chhazed","Eight Roads Ventures, On Mauritius",2000000,,India?s Only 100% Inspected and Certified Used Bikes Marketplace.,,,,,,,,,,,,,,,Satyukt,2020,3500000,2021,2500000,2022,1000000,2023,3000000,NA,NA,Pune,AgriTech,"Sat Tomer, Yukti Gill","NABVENTURES, Social Alpha (India)",500000,Seed,An agritech company that provides business to business (B2B) agricultural data,,,,,,,,,,,,,,,TREAD,2020,7700000,2021,5500000,2022,2200000,2023,6600000,NA,NA,Bangalore,Fitness,Dinesh Godara,"Better Capital, Kunal Shah, Gaurav Munjal",1100000,Pre-seed,A homegrown fitness startup that aims to advance the 'Fit India' initiative by offering holistic and affordable workouts.,,,,,,,,,,,,,,,Anveshan,2020,700000,2021,500000,2022,200000,2023,600000,NA,NA,Ahmedabad,FoodTech,"Aayushi Khandelwal, Akhil Kansal, Kuldeep Parewa",Titan Capital,100000,Pre-seed,Provide quality and healthy food products,,,,,,,,,,,,,,,TeaMonk,2020,6300000,2021,4500000,2022,1800000,2023,5400000,NA,NA,Gurugram,Food & Beverages,"Amit Dutta, Ashok Mittal","Lead Angels Network, Roots Ventures",900000,Pre-series A,India's Finest Specialty Tea company.,,,,,,,,,,,,,,,