Company/Brand,Year1,Revenue1,Year2,Revenue2,Year3,Revenue3,Year4,Revenue4,Year5,Revenue5,HQ,Sector,Founders,Investor,Amount($),Stage,What it does,,,,,,,,,,,,,,,TheCollegeFever,2018,1750000,2019,1250000,2020,500000,2021,1500000,2022,2250000,Mumbai,Marketplace,Shantanu Deshpande,Sixth Sense Ventures,250000,Seed,"TheCollegeFever is a hub for fun, fiesta and frolic of Colleges.",,,,,,,,,,,,,,1,7Happy Cow Dairy,2018,280000000,2019,200000000,2020,80000000,2021,240000000,2022,360000000,New Delhi,AgriTech,"Adamas Belva Syah Devara, Iman Usman.",General Atlantic,40000000,Seed,A startup which aggregates milk from dairy farmers in rural Maharashtra.,,,,,,,,,,,,,,,MyLoanCare,2018,455000000,2019,325000000,2020,130000000,2021,390000000,2022,585000000,Bangalore,Marketplace,Jatin Solanki,"Deepak Parekh, Amitabh Bachchan, Piyush Pandey",65000000,Series A,Leading Online Loans Marketplace in India,,,,,,,,,,,,,,2,5PayMe India,2018,14000000,2019,10000000,2020,4000000,2021,12000000,2022,18000000,Gurugram,Fintech,"Srikanth Iyer, Rama Harinath","Evolvence India Fund (EIF), Pidilite Group, FJ Labs",2000000,Angel,PayMe India is an innovative FinTech organization which offers short term financial suport to corporate employees.,,,,,,,,,,,,,,,Hasura,2018,11200000,2019,8000000,2020,3200000,2021,9600000,2022,14400000,Pune,SaaS,Narayana Reddy Punyala,Innovation in Food and Agriculture (IFA),1600000,Seed,"Hasura is a platform that allows developers to build, deploy, and host cloud-native applications quickly.",,,,,,,,,,,,,,2,2Tripshelf,2018,112000000,2019,80000000,2020,32000000,2021,96000000,2022,144000000,Bangalore,Marketplace,"Pavan Kushwaha, Paratosh Bansal, Dip Jung Thapa","Gilda VC, Art Venture, Rajeev Chitrabhanu.",16000000,Seed,Tripshelf is an online market place for holiday packages.,,,,,,,,,,,,,,,Hyperdata.IO,2018,350000000,2019,250000000,2020,100000000,2021,300000000,2022,450000000,Thane,Marketplace,Renuka Ramnath,Multiples Alternate Asset Management,50000000,Angel,Hyperdata combines advanced machine learning with human intelligence.,,,,,,,,,,,,,,4,6Pitstop,2018,700000000,2019,500000000,2020,200000000,2021,600000000,2022,900000000,Gurgaon,Electric Vehicle,"Peyush Bansal, Amit Chaudhary, Sumeet Kapahi",SoftBank,100000000,Seed,Pitstop offers general repair and maintenance services for cars through its doorstep service vehicles.,,,,,,,,,,,,,,,Mihuru,2018,1050000,2019,750000,2020,300000,2021,900000,2022,1350000,Mumbai,Financial Services,D Padmanabhan,Avataar Ventures,150000,Seed,Mihuru is an online platform which gives micro loans for air travel .,,,,,,,,,,,,,,5,9Fyle,2018,7700000,2019,5500000,2020,2200000,2021,6600000,2022,9900000,Bangalore,SaaS,"Puneet Gupta, Sucharita Mukherjee",Oikocredit,1100000,Seed,Fyle is an intelligent expense management platform for enterprises.,,,,,,,,,,,,,,,Antariksh Waste Ventures Pvt ltd,2018,3500000,2019,2500000,2020,1000000,2021,3000000,2022,4500000,Mumbai,Information Technology,Ishit Jethwa,Titan Capital,500000,Seed,Waste Management for Smart Cities,,,,,,,,,,,,,,,PaisaDukan,2018,4550000,2019,3250000,2020,1300000,2021,3900000,2022,5850000,Bangalore,Financial Services,Rakesh Malhotra,German development finance institution DEG,650000,Seed,A P2P lending marketplace platform,,,,,,,,,,,,,,,Sleepy Owl Coffee,2018,245000000,2019,175000000,2020,70000000,2021,210000000,2022,315000000,Bangalore,Food & Beverages,Byju Raveendran,"South Africa?s Naspers Ventures, the CPP Investment Board",35000000,Seed,"Makers of a signature coffee that's exceptional in taste. It's super easy to brew, requires no equipment & ships to your door.",,,,,,,,,,,,,,,BlueJack,2018,448000000,2019,320000000,2020,128000000,2021,384000000,2022,576000000,Vadodara,Electric Vehicle,"Chapman, Priya Sharma, Ashish Anantharaman",Goldman Sachs.,64000000,Seed,Delhi-based online used vehicles marketplace.,,,,,,,,,,,,,,,Pando,2018,14000000,2019,10000000,2020,4000000,2021,12000000,2022,18000000,Gurugram,Supply Chain Management,Amit Modi,Mumbai Angels Network,2000000,Seed,A startup which digitizes logistics operations for Fortune 500 companies.,,,,,,,,,,,,,,,Mintifi,2018,14000000,2019,10000000,2020,4000000,2021,12000000,2022,18000000,Mumbai,Financial Services,Renato Araujo,Brazilian VC Fund Confrapar,2000000,Seed,Online lending startup based in Mumbai.,,,,,,,,,,,,,,,Carcrew,2018,14000000,2019,10000000,2020,4000000,2021,12000000,2022,18000000,Mumbai,Marketplace,"Harsimarbir Singh, Dr Vaibhav Kapoor, Dr Garima Sawhney","Sequoia India, Hummingbird Ventures, Greenoaks Capital, AngelList.",2000000,Seed,India's Online Auto Repair Marketplace,,,,,,,,,,,,,,,Ideal Insurance Brokers/ 121Policy.com,2018,7000000,2019,5000000,2020,2000000,2021,6000000,2022,9000000,Pune,Insurtech,"Gautam Tambay, Parul Gupta",Reach Capital,1000000,Seed,Ideal Insurance Broking is one of the leaders in insurance broking domain.,,,,,,,,,,,,,,,Mojro Technologies,2018,4550000,2019,3250000,2020,1300000,2021,3900000,2022,5850000,Mumbai,Supply Chain Management,"Tushar Kumar, Prashant Singh",Wilson Global Opportunities Fund,650000,Seed,Mojro envisions to be the world's largest technology-enabled logistics platform.,,,,,,,,,,,,,,,Elemential,2018,7000000,2019,5000000,2020,2000000,2021,6000000,2022,9000000,Mumbai,Blockchain,"Arihant Jain, Ajeet Kushwaha",Sequoia Capita,1000000,Seed,"Blockchain Development Platform To Design, Run & Scale Blockchain Networks.",,,,,,,,,,,,,,,Loadshare,2018,35000000,2019,25000000,2020,10000000,2021,30000000,2022,45000000,Bangalore,Supply Chain Management,"Nishant Jain, Rohan Kumar",IVM Intersurer,5000000,Series A,LoadShare is India?s fastest growing logistics company,,,,,,,,,,,,,,,Yumlane,2018,28000000,2019,20000000,2020,8000000,2021,24000000,2022,36000000,Bangalore,Food & Beverages,Sam Udotong,Canaan Partners,4000000,Series A,Food startup Yumlane operated by QwikPik Technology,,,,,,,,,,,,,,,Kriger Campus,2018,210000000,2019,150000000,2020,60000000,2021,180000000,2022,270000000,Bangalore,Education,"Sandipan Mitra, Uttam Kumar","Paytm, Asian VC fund NPTK, Sabre Partners, Neoplux.",30000000,Seed,A Education Start Up.,,,,,,,,,,,,,,,Pipa+Bella,2018,7000000,2019,5000000,2020,2000000,2021,6000000,2022,9000000,Bangalore,E-commerce,"Nukul Upadhye, Mahesh Jakhotia, Jitender Bedwal, Daya Rai, Nikhil Tripathi","Omnivore and Omidyar Network India, Sequoia Capital",1000000,Series A,Pipa+Bella is an online store aimed at selling fashionable and affordable costume jewelry at par with international standards and trends,,,,,,,,,,,,,,,Kaleidofin,2018,19600000,2019,14000000,2020,5600000,2021,16800000,2022,25200000,Hyderabad,Financial Services,"Vivek Gupta, Abhay Hanjura",Vertex Growth Fund,2800000,Seed,A fintech platform.,,,,,,,,,,,,,,,IndigoLearn,2018,1050000,2019,750000,2020,300000,2021,900000,2022,1350000,Bangalore,E-Learning,"Babu Dayal, Pramod Uniyal, Lalit Mehta",Rajan Kaistha,150000,Seed,India's the premier education destination catering to the needs of aspiring students of the CA community.,,,,,,,,,,,,,,,UClean,2018,280000000,2019,200000000,2020,80000000,2021,240000000,2022,360000000,Pune,Cleantech,"Deepak Garg, Gazal Kalra","SAIF Partners India VI Ltd, Spring Canter Investment Ltd",40000000,Seed,UClean is a tech enabled laundry service provider.,,,,,,,,,,,,,,,Coutloot,2018,7000000,2019,5000000,2020,2000000,2021,6000000,2022,9000000,Hyderabad,E-commerce,"Vivek Prabhakar, Boris Zha","Korea Investment Partners (KIP), Samsung Venture Investment Corporation (SVIC), UOB Venture, 10 Fund, CVCapital, Zero2IPO Ventures, M&S Partners",1000000,Seed,The Fashion Re-commerce platform.,,,,,,,,,,,,,,,Finzy,2018,9100000,2019,6500000,2020,2600000,2021,7800000,2022,11700000,Mumbai,Financial Services,"Amit Acharya, Srinath Ramakkrushnan","Lightspeed and Greenoaks Capital, Sequoia India, Accel and Kae Capital",1300000,Seed,finzy is the premier peer to peer lending solution in India.,,,,,,,,,,,,,,,Fitternity,2018,14000000,2019,10000000,2020,4000000,2021,12000000,2022,18000000,New Delhi,Health Care,Swapnil,Scale Venture Partners,2000000,Seed,India's largest online fitness platform that provides an integrated eco-system to help users start & sustain their fitness journey,,,,,,,,,,,,,,,Tolet for Students,2018,35000000,2019,25000000,2020,10000000,2021,30000000,2022,45000000,Mumbai,Hospitality,Rajendra Lora,ThinkLab,5000000,Seed,"Reserve your Room, Hostel or Paying Guest, while relocating for higher education.",,,,,,,,,,,,,,,Chai Kings,2018,140000000,2019,100000000,2020,40000000,2021,120000000,2022,180000000,Bangalore,Food & Beverages,,"Sajan Pillai, Muthu Krishnan,",20000000,Seed,Chai Kings is a tea retail chain,,,,,,,,,,,,,,,Dainik Jagran,2018,280000000,2019,200000000,2020,80000000,2021,240000000,2022,360000000,Bangalore,Media,"Pulkit Agrawal, Prashant Sachan, Arun Lodhi, Bimal Kartheek Rebba","Ruizheng Investment, Tej Kapoor, Krinshavataram Venkata Vinjamuri, Harsh Shah",40000000,Seed,Dainik Jagran is a media and communications group.,,,,,,,,,,,,,,,Playtoome,2018,140000000,2019,100000000,2020,40000000,2021,120000000,2022,180000000,Hyderabad,Advertisement,Akshay Narvekar,Lightbox Ventures,20000000,Seed,Playtoome is a live entertainment destination,,,,,,,,,,,,,,,ONGO Framework,2018,7000000,2019,5000000,2020,2000000,2021,6000000,2022,9000000,Bangalore,Information Technology,Deepak Anchala,Stellaris Ventures,1000000,Angel,ONGO Framework is a B2B IT and digital solution provider.,,,,,,,,,,,,,,,Notesgen,2018,87500000,2019,62500000,2020,25000000,2021,75000000,2022,112500000,Pune,Education,"Vaibhav Gupta, Himanshu Devra, Pranav Chaudhary, Nishtha Gupta","Manipal Education and Medical Group (MEMG) family office, Titan Capital",12500000,Seed,A Global Peer-to-Peer and Peer-to-Group Learning Platform that helps students supplement their academic & competitive exam prep.,,,,,,,,,,,,,,,Arogya MedTech,2018,105000000,2019,75000000,2020,30000000,2021,90000000,2022,135000000,Hyderabad,Health Care,"Devendra Gupta, Prateek Singhal, Vivek Pandey",Innovation in Food & Agriculture Fund (IFA Fund),15000000,Seed,Arogya MedTech is a Research & Development organization in Bio-Medical industry.,,,,,,,,,,,,,,,Propshop24,2018,3500000,2019,2500000,2020,1000000,2021,3000000,2022,4500000,Mumbai,E-commerce,"Amit Raj, Anshul Gupta",Trifecta Capital,500000,Seed,"Propshop24, a one-stop shop for a handpicked selection of 'fun'tastic products from around the world.",,,,,,,,,,,,,,,ZestMoney,2018,93800000,2019,67000000,2020,26800000,2021,80400000,2022,120600000,New Delhi,Fintech,"Manish Taneja, Rahul Dash",Goldman Sachs,13400000,Series A,Zest is India's first completely automated consumer digital lending platform.,,,,,,,,,,,,,,,MyDentistChoice,2018,3500000,2019,2500000,2020,1000000,2021,3000000,2022,4500000,Mumbai,Health Care,"Sanjay Bhatia, Bharat Tanvi, Punit Java","Amplo, FJ Labs, Rogue One Capital",500000,Seed,MyDentistChoice is a direct sales and distribution of dental equipment and accessories from top name manufacturers,,,,,,,,,,,,,,,MedCords,2018,184800000,2019,132000000,2020,52800000,2021,158400000,2022,237600000,Gurugram,Health Care,"Mayank Dhanuka, Sunoor Kaul","Oikocredit, Caspian SME Impact Fund IV,ØØTriodos Investment Management",26400000,Seed,Medcords is India?s first holistic healthcare ecosystem on a cloud platform that makes health management easier,,,,,,,,,,,,,,,Ultraviolette Automotive,2018,420000,2019,300000,2020,120000,2021,360000,2022,540000,Mumbai,Electric Vehicle,"Sawan Kumar, Bhavya Bhambhani",Undisclosed,60000,Series A,Ultraviolette is a startup working on electric two-wheelers and energy infrastructure.,,,,,,,,,,,,,,,Inthree Access,2018,28000000,2019,20000000,2020,8000000,2021,24000000,2022,36000000,Bangalore,Consulting,"Krishnan, Manju Dhawan, K Satyanarayana, Sanjeev Saxena",CDC Group,4000000,Series A,Inthree Access is an impact venture that connects the most inaccessible rural markets with products that can transform lives in Rural India.,,,,,,,,,,,,,,,BUGWORKS Research India,2018,63000000,2019,45000000,2020,18000000,2021,54000000,2022,81000000,Hyderabad,Pharmacy,Visakh Sasikumar,GAIL (India) Ltd,9000000,Series A,BUGWORKS is a drug discovery company.,,,,,,,,,,,,,,,PrestLoans,2018,700000,2019,500000,2020,200000,2021,600000,2022,900000,Kolkata,Fintech,Saurav Kumar,"Blume Ventures, Emergent Ventures",100000,Seed,"PrestLoans New age tech driven RBI regd NBFC helping businesses by providing easy, quick n hassle free loans.",,,,,,,,,,,,,,,Wimoxez,2018,140000,2019,100000,2020,40000,2021,120000,2022,180000,Noida,Internet,Malika Sadani,"Saama Capital, DSG Consumer Partners",20000,Seed,"Data Intelligence Publishing Platform, We bring the best resources to learn valuable technologies which will shape tomorrow.",,,,,,,,,,,,,,,HappyEMI,2018,7000000,2019,5000000,2020,2000000,2021,6000000,2022,9000000,Bangalore,Fintech,"Ashish Bhatia, Himanshu Gupta","Pramendra Tomar, Ratish Pandey, Munish Bhatia, Sumit Aggarwal",1000000,Seed,HappyEMI is a point of sale digital lending platform that helps consumers finance their purchases in-store and online,,,,,,,,,,,,,,,Propelld,2018,1750000,2019,1250000,2020,500000,2021,1500000,2022,2250000,Mumbai,Fintech,Manan Khurma,"Manta Ray Ventures Limited, Google?s Capital G, Sequoia India.",250000,Seed,Propelld is a student education financing platform.,,,,,,,,,,,,,,,ZiffyHomes,2018,840000,2019,600000,2020,240000,2021,720000,2022,1080000,Mumbai,Marketplace,"Vivek Gupta, Abhay Hanjura",Vertex Ventures,120000,Seed,ZiffyHomes is a technology driven marketplace to find out home on rent.,,,,,,,,,,,,,,,Carmesi,2018,238000000,2019,170000000,2020,68000000,2021,204000000,2022,306000000,Bangalore,Health Care,,HNI investors,34000000,Seed,Carmesi is a brand of high-end menstrual-hygiene products in India.,,,,,,,,,,,,,,,Racetrack,2018,2394000000,2019,1710000000,2020,684000000,2021,2052000000,2022,3078000000,Bangalore,Artificial Intelligence,Amit Jain,"Ping An Global Voyager Fund, Hillhouse Capital, Sequoia Capital",342000000,Seed,"Racetrack is a sales and support-focused AI-driven platform designed for education, real estate, and e-commerce sectors.",,,,,,,,,,,,,,,WHR,2018,1002015,2019,715725,2020,286290,2021,858870,2022,1288305,Bangalore,Information Technology,"Abhishek Bansal, Vaibhav Khandelwal","Flipkart, Eight Roads Ventures, NGP Capital, Qualcomm Ventures, Mirae Asset Naver Fund, World Bank-backed IFC",143145,Seed,"WHR is to make affordable healthcare a reality for all. Our vision is to make healthcare services easier, better and more accessible.",,,,,,,,,,,,,,,FabAlley,2018,4200000000,2019,3000000000,2020,1200000000,2021,3600000000,2022,5400000000,Mumbai,E-commerce,Mittal,"Omidyar Network, Eight Roads Ventures, GrowthStory, AngelList",600000000,Series B,"FabAlley is the ultimate Indian fashion destination for fashion-forward, indie-chic girls. Founded in 2012, Tanvi Malik and Shivani Poddar",,,,,,,,,,,,,,,SBI Life,2018,5194000000,2019,3710000000,2020,1484000000,2021,4452000000,2022,6678000000,Gurugram,Insurtech,Sumit Sinha,"LetsVenture, 91 Springboard, IKP Knowledge, Angel investors, AbInbev-Serge DeVos, Wouter Peeters.",742000000,Private Equity,SBI Life is one of the life insurance company that offers a range of life insurance plans and policies to protect you and your family.,,,,,,,,,,,,,,,Studds Accessories,2018,7000000000,2019,5000000000,2020,2000000000,2021,6000000000,2022,9000000000,Mumbai,E-commerce,Sarvesh Shashi,"Venture fund, Fireside Ventures.",1000000000,Private Equity,Studds Accessories is a scooter accessories service provider in India,,,,,,,,,,,,,,,Design Cafe,2018,14000000000,2019,10000000000,2020,4000000000,2021,12000000000,2022,18000000000,Noida,Home Decor,Paddy Padmanabhan,Saravanan Adiseshan,2000000000,Series B,"Design + Execution Organization that delivers beautiful & innovative designs for Home Interiors, in any budget.",,,,,,,,,,,,,,,NoPaperForms Solutions Pvt. Ltd.,2018,27860000,2019,19900000,2020,7960000,2021,23880000,2022,35820000,Noida,SaaS,"Bhavish Aggarwal, Ankit Bhati","Kia Motors, Hyundai",3980000,Series B,"NoPaperForms is a marketing automation, lead nurture and enrolment management platform for educational institutions",,,,,,,,,,,,,,,Rays Power Infra,2018,14000000000,2019,10000000000,2020,4000000000,2021,12000000000,2022,18000000000,Pune,Renewable Energy,"Greg Moran, David Back",Zoomcar Inc,2000000000,Venture - Series Unknown,Rays Power Infra is a leading integrated Solar Power Company.,,,,,,,,,,,,,,,AuthMetrik,2018,70000,2019,50000,2020,20000,2021,60000,2022,90000,Gurugram,SaaS,Pavan Kushwaha,"Gilda VC, Art Venture, Rajeev Chitrabhanu",10000,Grant,"SaaS, B2B, Security, Stop account sharing, Fraud Detection",,,,,,,,,,,,,,,LetsTransport,2018,7000000000,2019,5000000000,2020,2000000000,2021,6000000000,2022,9000000000,Mumbai,Transportation,"Jeevan Chowdary M, Harshit Harchani",US-based angel investors,1000000000,Series B,Lets transport is a logistics solution provider.,,,,,,,,,,,,,,,Next Digital Solutions,2018,700000,2019,500000,2020,200000,2021,600000,2022,900000,Bangalore,Marketplace,Ritesh Agarwal,"MyPreferred Transformation, Avendus Finance, SoftBank",100000,Angel,Next Digital Solutions is website design & Digital Marketing development company.,,,,,,,,,,,,,,,Portea Medical,2018,1750000000,2019,1250000000,2020,500000000,2021,1500000000,2022,2250000000,Bangalore,Health Care,"Amit Bhasin, Kushal Karwa, Nitin Rana, Rishabh Karwa",Sequoia Capital,250000000,Debt Financing,Portea Medical is the largest and fastest growing provider of in-home medical care in India today with a 24-city network.,,,,,,,,,,,,,,,Aavas Financiers,2018,14000000000,2019,10000000000,2020,4000000000,2021,12000000000,2022,18000000000,Hyderabad,Financial Services,"Niraj Singh, Ramanshu Mahaur, Ganesh Pawar, Mohit Gupta","Norwest Venture Partners, General Catalyst, Fundamentum, Accel Partners",2000000000,Post-IPO Debt,"Aavas Financiers is engaged in the business of providing housing loans, primarily in the un-served, unreached and under-served market.",,,,,,,,,,,,,,,Swiggy,2018,7000000000,2019,5000000000,2020,2000000000,2021,6000000000,2022,9000000000,Bangalore,Food Delivery,Rajendra Setia,"TPG, Norwest Venture Partners, Evolvence India",1000000000,Series H,Swiggy is a food ordering and delivery company that provides food service solutions for restaurants.,,,,,,,,,,,,,,,Milkbasket,2018,49000000,2019,35000000,2020,14000000,2021,42000000,2022,63000000,Thane,E-commerce,"Prasanna Manogaran, Bharani C L",Angel investors,7000000,Series A,"Milkbasket delivers milk, bread, eggs, butter, juices and other daily need items, every morning, right at your doorstep, free of charge.",,,,,,,,,,,,,,,Toppr,2018,245000000,2019,175000000,2020,70000000,2021,210000000,2022,315000000,Bangalore,Education,"Saurabh Dixit, Gurudutt Upadhyay",GSF Accelerator,35000000,Series C,Toppr.com is an online preparation platform for entrance exams in India.,,,,,,,,,,,,,,,Vivriti Capital,2018,199500000,2019,142500000,2020,57000000,2021,171000000,2022,256500000,Bangalore,Financial Services,"Ashish Rajan Singh, Harshit Gupta, Nishant Mahatre, Tauseef Khan","Siana Capital Management, Info Edge",28500000,Venture - Series Unknown,Vivriti Capital is an online platform for institutional debt in India.,,,,,,,,,,,,,,,Impact Guru,2018,14000000,2019,10000000,2020,4000000,2021,12000000,2022,18000000,New Delhi,Health Care,"Rubal Chib, Dr Srishti Batra","Venture Catalysts, 9Unicorns Accelerator Fund",2000000,Series A,"We're a Harvard incubated crowdfunding platform for nonprofits, social enterprises, startups and individuals.",,,,,,,,,,,,,,,MobiKwik,2018,1680000000,2019,1200000000,2020,480000000,2021,1440000000,2022,2160000000,Bangalore,Fintech,Ajay Sakhamuri,ICICI Bank.,240000000,Series E,MobiKwik is a payments backed fintech platform in India. MobiKwik App offers instant loans & investment products to the 500M masses of India,,,,,,,,,,,,,,,DataTrained,2018,840000000,2019,600000000,2020,240000000,2021,720000000,2022,1080000000,Bangalore,Education,"Amar Prabhu, Ashwin Soni, Sumit Maniyar","KB Investment, Bertelsmann India Investments",120000000,Seed,"DataTrained is a educational platform, which operates an ed-tech startup on data science",,,,,,,,,,,,,,,OneAssist,2018,16800000,2019,12000000,2020,4800000,2021,14400000,2022,21600000,New Delhi,SaaS,Meghana Narayan,Fireside Ventures,2400000,Debt Financing,OneAssist is a protection & assistance services platform.,,,,,,,,,,,,,,,Satin Creditcare Network Limited (SCNL),2018,210000000,2019,150000000,2020,60000000,2021,180000000,2022,270000000,Bangalore,Financial Services,Ankur Jain,"Sequoia Capital India, Sixth Sense Ventures",30000000,Post-IPO Debt,Satin is a non-banking finance company providing individual loans to urban shopkeepers.,,,,,,,,,,,,,,,APAC Financial Services,2018,17500000000,2019,12500000000,2020,5000000000,2021,15000000000,2022,22500000000,Gurugram,Financial Services,"Akil Sethuraman, Anup Gopinath, Rachna Rao",Rebel Foods,2500000000,Private Equity,APAC Financial Services is a financial services platform.,,,,,,,,,,,,,,,Moglix,2018,161000000,2019,115000000,2020,46000000,2021,138000000,2022,207000000,Pune,E-commerce,"Deepinder Goyal, Gaurav Gupta, Pankaj Chaddah","Kora, Tiger Global Management",23000000,Series C,"Moglix is a supplier of industrial tools like hand tools, power tools, electrical, and safety equipment.",,,,,,,,,,,,,,,MadGuy Labs,2018,1050000,2019,750000,2020,300000,2021,900000,2022,1350000,Ahmedabad,E-Learning,"Miran Junaidi, Saurabh Ghanekar, Sourav Sanyal","100X VC, Amara Ventures",150000,Venture - Series Unknown,MadGuy Labs is a Online Test-prep Platform.,,,,,,,,,,,,,,,Shop101,2018,77000000,2019,55000000,2020,22000000,2021,66000000,2022,99000000,Bangalore,E-commerce,"Gautam Kapoor, Saahil Goel, Vishesh Khurana","Bertelsmann India Investments, InnoVen Capital",11000000,Series B,#1 Online Selling App. India?s leading social commerce platform. Setup free online store in 2 min. Sell own goods or resell Shop101 Supply.,,,,,,,,,,,,,,,FeedMyPockets,2018,308000000,2019,220000000,2020,88000000,2021,264000000,2022,396000000,Jaipur,Advertisement,Prashant Agarwal,"BlackSoil, Caspian",44000000,Seed,On Demand Staffing Platform,,,,,,,,,,,,,,,FoodBuddy,2018,420000000,2019,300000000,2020,120000000,2021,360000000,2022,540000000,Gurugram,Food Delivery,Vikrant Varshney,,60000000,Seed,"FoodBuddy is a online food delivery portal, providing boundary breaking delivery.",,,,,,,,,,,,,,,Ninjacart,2018,17500000000,2019,12500000000,2020,5000000000,2021,15000000000,2022,22500000000,Mumbai,AgriTech,Sujit Bangar,Zenith Global,2500000000,Series B,Ninjacart is a B2B agri-marketing platform that connects vegetables and fruits farmers directly with businesses.,,,,,,,,,,,,,,,BYJU?S,2018,3780000000,2019,2700000000,2020,1080000000,2021,3240000000,2022,4860000000,Gurugram,Education,Karanpal Singh,,540000000,Private Equity,BYJU?s is an edtech company that is reinventing how students learn through its learning app.,,,,,,,,,,,,,,,Wakefit,2018,4550000000,2019,3250000000,2020,1300000000,2021,3900000000,2022,5850000000,Noida,Manufacturing,"Neeraj Khandelwal, Sumit Gupta","Coinbase Ventures, Polychain",650000000,Venture - Series Unknown,Wakefitkart is a mattress manufacturing company. We manufacture the best quality mattresses at affordable prices.,,,,,,,,,,,,,,,Hero Electric,2018,11200000000,2019,8000000000,2020,3200000000,2021,9600000000,2022,14400000000,Mumbai,Manufacturing,Naveen Tewari,Mithril Capital Management.,1600000000,Venture - Series Unknown,"Hero Electric, a 100% subsidiary of the Hero Group, is a pioneer in the Indian Electric Vehicle Industry.",,,,,,,,,,,,,,,PerkFinance,2018,6300000,2019,4500000,2020,1800000,2021,5400000,2022,8100000,Hyderabad,Fintech,"Chattanathan Devarajan, Prasanna Rao, Anand Chandra",Quona Capital,900000,Seed,PerkFinance partners with employers to provide affordable loans to their employees at no cost to the company,,,,,,,,,,,,,,,Roposo,2018,70000000,2019,50000000,2020,20000000,2021,60000000,2022,90000000,New Delhi,Information Technology,"Ankit Kaushik, Gaurav Mangla, Rhitiman Majumder",Swastika,10000000,Series C,Roposo - TV by the People is a unique social media platform where people express visually with homemade videos and photos.,,,,,,,,,,,,,,,OTO Capital,2018,350000000,2019,250000000,2020,100000000,2021,300000000,2022,450000000,Gurugram,Electric Vehicle,"Burzin Engineer, Rahul Chari, Sameer Nigam","Flipkart, Walmart",50000000,Seed,OTO Capital is a platform that allows you to own a car faster than ever.,,,,,,,,,,,,,,,Boodmo,2018,490000000,2019,350000000,2020,140000000,2021,420000000,2022,630000000,Gurugram,Electric Vehicle,Nirmal Shah,"Delhi Private School, UAE, Interstar",70000000,Seed,boodmo.com - large online marketplace for auto parts in India.,,,,,,,,,,,,,,,MyNewCar.in,2018,7000000,2019,5000000,2020,2000000,2021,6000000,2022,9000000,Gurugram,Electric Vehicle,"Chetan Indap, Sunny Sharma, Deepanti Kavi",Malpani Ventures,1000000,Venture - Series Unknown,MyNewCar.in offers new cars at best price with great deals. Book a new car online or request a doorstep test drive,,,,,,,,,,,,,,,HalaPlay Technologies,2018,35000000,2019,25000000,2020,10000000,2021,30000000,2022,45000000,Chennai,Digital platform,Ronak Sarda,Angel investors,5000000,Series A,A daily fantasy sports platform.,,,,,,,,,,,,,,,PlanetSpark,2018,112000000,2019,80000000,2020,32000000,2021,96000000,2022,144000000,Pune,E-Learning,"Vinayak, Kshitij Abhishek, Apoorv Sadana",Whiteboard Capital,16000000,Seed,PlanetSpark is an after-school Maths and English learning program for pre teen kids between Grades 2nd to 7th.,,,,,,,,,,,,,,,Forum for Innovation Incubation Research and Entrepreneurship,2018,717500000,2019,512500000,2020,205000000,2021,615000000,2022,922500000,Gurugram,Investment Banking,"Ankit Garg, Chaitanya Ramalingegowda",Sequoia Capital.,102500000,Grant,"FiiRE, a technology business incubator helps the startup process to move from the garage to the lab.",,,,,,,,,,,,,,,