Company/Brand,Year1,Revenue1,Year2,Revenue2,Year3,Revenue3,Year4,Revenue4,Year5,Revenue5,HQ,Sector,Founders,Investor,Amount($),Stage,What it does,,,,,,,,,,,,,,,Flick Stree,2020,21000000,2021,15000000,2022,6000000,2023,18000000,NA,NA,Pune,Artificial Intelligence,Saurabh Singh,Samsung Venture Investment,3000000,Series A,Artificial intelligence-based video publishing network,,,,,,,,,,,,,,,Qure ai,2020,112000000,2021,80000000,2022,32000000,2023,96000000,NA,NA,Silvassa,Health Care,"Prashant Warier, Pooja Rao",Sequoia India,16000000,,Provides interpretations of radiology scans,,,,,,,,,,,,,,,Josh Talks,2020,10500000,2021,7500000,2022,3000000,2023,9000000,NA,NA,Mumbai,Media,"Supriya Paul, Shobhit Banga",Media Development Investment Fund,1500000,Pre series A,Community of young individuals providing a platform to showcase their stories,,,,,,,,,,,,,,,RailYatri,2020,96600000,2021,69000000,2022,27600000,2023,82800000,NA,NA,Mumbai,Travel,"Manish Rathi, Kapil Raizada, Sachin Saxena","Nandan Nilekani, Samsung Venture Investment Corporation",13800000,,A complete Indian railways app,,,,,,,,,,,,,,,AjnaLens,2020,10500000,2021,7500000,2022,3000000,2023,9000000,NA,NA,Bangalore,Deeptech,"Pankaj Raut, Abhishek Tomar, Abhijit Patil","Maharashtra Defence, Aerospace Venture Fund (MDAVF)",1500000,Pre series A,"It leverages technologies such as AR, VR & AI to offer hardware in areas such as education and defence",,,,,,,,,,,,,,,Pepper,2020,2148300,2021,1534500,2022,613800,2023,1841400,NA,NA,Bangalore,Marketplace,Anirudh Singla and Rishabh Shekhar,"Kunal Bahl, Rohit Bansal",306900,Seed funding,End to end content creation platform,,,,,,,,,,,,,,,Rupeek,2020,210000000,2021,150000000,2022,60000000,2023,180000000,NA,NA,Noida,Fintech,"Amar Prabhu, Ashwin Soni, Sumit Maniyar","GGV Capital, Bertelsmann India Investments, Binny Bansal, Sequoia India, Accel Partners",30000000,,An asset backed online lending platform,,,,,,,,,,,,,,,iMerit,2020,140000000,2021,100000000,2022,40000000,2023,120000000,NA,NA,Gurugram,Information Technology,Radha Basu,CDC Group Plc,20000000,Series B,Turns information into data that is usable for machine learning processes,,,,,,,,,,,,,,,BharatPe,2020,525000000,2021,375000000,2022,150000000,2023,450000000,NA,NA,Ahmedabad,Fintech,Ashneer Grover,Ribbit Capital,75000000,Series C,Digital payments platform,,,,,,,,,,,,,,,Invideo,2020,17500000,2021,12500000,2022,5000000,2023,15000000,NA,NA,Hyderabad,Media,Sanket Shah,Sequoia Capital?s Surge,2500000,,Video production and editing platform,,,,,,,,,,,,,,,AvalonMeta,2020,2940000,2021,2100000,2022,840000,2023,2520000,NA,NA,Gurugram,EdtTech,"Varun Mayya, Shashank Udupa, Abhinav Arora",Peerplays,420000,,It combines higher education and competitive gaming,,,,,,,,,,,,,,,Near Store,2020,2100000,2021,1500000,2022,600000,2023,1800000,NA,NA,Gurugram,E-commerce,,Sauce.vc,300000,Seed Round,Enables a shop to create an online presence,,,,,,,,,,,,,,,Prayaan Capital,2020,8400000,2021,6000000,2022,2400000,2023,7200000,NA,NA,Mumbai,Fintech,"Madhan Mohan , Akash Chelvam",Accion Venture Lab,1200000,Seed Round,"NBFC that lends to micro, small, and medium-sized enterprises (MSMEs)",,,,,,,,,,,,,,,Sanfe,2020,7700000,2021,5500000,2022,2200000,2023,6600000,NA,NA,Bangalore,Hospitality,"Archit Agarwal, Harry Sehrawat","SucSEED Venture Partners, BIRAC, Elixir Pharma, Titan Capital",1100000,Pre series A,Women health care and wellness product,,,,,,,,,,,,,,,Go Desi,2020,4391100,2021,3136500,2022,1254600,2023,3763800,NA,NA,Gurugram,FoodTech,Vinay Kothari,Rukam Capital,627300,Seed Round,Provides traditional delicacies,,,,,,,,,,,,,,,Swiggy,2020,791000000,2021,565000000,2022,226000000,2023,678000000,NA,NA,Bangalore,FoodTech,"Nandan Reddy, Sriharsha Majety, Rahul Jaimini",Prosus N.V,113000000,Series A,Platform to order food online from restaurants and getting it delievered,,,,,,,,,,,,,,,Whatfix,2020,224000000,2021,160000000,2022,64000000,2023,192000000,NA,NA,Gurugram,SaaS,"Khadim Batti, Vara Kumar",Sequoia Capital India,32000000,Series C,"Digital adoption platform that helps companies provide intuitive onboarding, training and support",,,,,,,,,,,,,,,Unacademy,2020,770000000,2021,550000000,2022,220000000,2023,660000000,NA,NA,Bangalore,EdtTech,"Gaurav Munjal, Roman Saini, Hemesh Singh","Facebook, General Atlantic, Sequoia India, Nexus Venture Partners, Steadview Capital, Blume Ventures",110000000,Series E,Platform that offers online education in India,,,,,,,,,,,,,,,Dunzo,2020,77000000,2021,55000000,2022,22000000,2023,66000000,NA,NA,Gurugram,Logistics & Supply Chain,Kabeer Biswas,Alteria Capital,11000000,,India-based hyperlocal delivery startup,,,,,,,,,,,,,,,Digit Insurance,2020,2380000,2021,1700000,2022,680000,2023,2040000,NA,NA,Bangalore,Insurtech,Kamesh Goyal,"Virat Kohli, Anushka Sharma",340000,,General Insurance Company,,,,,,,,,,,,,,,Yolo,2020,4200000,2021,3000000,2022,1200000,2023,3600000,NA,NA,Bangalore,Transportation,"Shailesh Gupta, Mukul Shah, Danish Chopra",Undisclosed,600000,Seed funding,Intercity transportation,,,,,,,,,,,,,,,SmartVizX,2020,9779000,2021,6985000,2022,2794000,2023,8382000,NA,NA,Bangalore,SaaS,"Tithi Tewari, Gautam Tewari",Rockstud Capital,1397000,Pre series A,It developed India?s first VR-based design communication and collaboration product Trezi,,,,,,,,,,,,,,,MaxWholesale,2020,21000000,2021,15000000,2022,6000000,2023,18000000,NA,NA,New Delhi,E-commerce,Samarth Agrawal,"IAN Fund-I,ØØAl Falaj Investment Company (AFI)",3000000,Series A,B2B ecommerce platform for kirana stores,,,,,,,,,,,,,,,Carbon Clean,2020,112000000,2021,80000000,2022,32000000,2023,96000000,NA,NA,Bangalore,Cleantech,"Aniruddha Sharma, Prateek Bumb","WAVE Equity Partners, Chevron Technology Ventures, Marubeni Corporation.",16000000,,Develops affordable carbon capture technology,,,,,,,,,,,,,,,Genius Corner,2020,1750000,2021,1250000,2022,500000,2023,1500000,NA,NA,Bangalore,EdtTech,"Vishal Khatter, Dheeraj Khatter, Dipak Varshney","Mahesh Mohta, Jyoti Arora, Nachu Subramanian, Srivats",250000,,Framework to enable personalised learning using artificial intelligence (AI) and machine learning (ML).,,,,,,,,,,,,,,,PlanetSpark,2020,3139500,2021,2242500,2022,897000,2023,2691000,NA,NA,Gurugram,EdtTech,"Maneesh Dhooper, Kunal Malik","Indian Angel Network, Lead Angels, Hyderabad Angels",448500,,Provides neighbourhood learning zones where children learn and develop 'new-age' skills under one roof,,,,,,,,,,,,,,,Shuttl,2020,55829900,2021,39878500,2022,15951400,2023,47854200,NA,NA,Bangalore,Transportation,"Amit Singh, Deepanshu Malviya",SIG Global India Fund,7975700,Series C,App based bus aggregator serice,,,,,,,,,,,,,,,Oga,2020,2310000,2021,1650000,2022,660000,2023,1980000,NA,NA,Chennai,Fitness,Ashish Rawat,Inflection Point Ventures,330000,,Provides interactive fitness experience to people across the world,,,,,,,,,,,,,,,Paytm money,2020,39200000,2021,28000000,2022,11200000,2023,33600000,NA,NA,Bangalore,Fintech,Vijay Shekhar Sharma,One97 Communications,5600000,,Wealth Management,,,,,,,,,,,,,,,Vedantu,2020,168000000,2021,120000000,2022,48000000,2023,144000000,NA,NA,New Delhi,EdtTech,"Saurabh Saxena, Pulkit Jain, Anand Prakash, Vamsi Krishna",GGV Capital,24000000,Series C,Onine learning platform,,,,,,,,,,,,,,,Yap,2020,9814000,2021,7010000,2022,2804000,2023,8412000,NA,NA,New Delhi,Fintech,"Madhusudanan R, Muthukumar and Prabhu","Amrish Rau, Kunal Shah, Jitendra Gupta",1402000,,Banking and payment products-focused API platform,,,,,,,,,,,,,,,Clover,2020,38500000,2021,27500000,2022,11000000,2023,33000000,NA,NA,Gurugram,AgriTech,"Avinash BR, Gururaj Rao, Arvind Murali, Santhosh Narasipura","Omnivore, Accel Partners, Mayfield",5500000,Series A,Provides agricultural solution to farmers working in the greenhouse production of vegetables and fruits,,,,,,,,,,,,,,,Nova Credit,2020,350000000,2021,250000000,2022,100000000,2023,300000000,NA,NA,Bangalore,Fintech,Nicky Goulimis,"Kleiner Perkins, Canapi Ventures, Index Ventures, Nyca Partners, General Catalyst.",50000000,Series B,Cross-border consumer credit startup,,,,,,,,,,,,,,,CodingNinjas,2020,36400000,2021,26000000,2022,10400000,2023,31200000,NA,NA,Pune,EdtTech,"Singla, Kannu Mittal, Dhawal Parate",Info Edge Ltd,5200000,Series A,Online learning platform,,,,,,,,,,,,,,,Furlenco,2020,15400000,2021,11000000,2022,4400000,2023,13200000,NA,NA,Bangalore,E-commerce,Ajith Mohan Karimpana,Chowdry Associates,2200000,Series C,Furniture rental startup,,,,,,,,,,,,,,,HempStreet,2020,7000000,2021,5000000,2022,2000000,2023,6000000,NA,NA,Bangalore,Health Care,Abhishek Mohan,Pharmacon Holdings,1000000,Pre series A,Manufacturer of ayurvedic medicines based on cannabis,,,,,,,,,,,,,,,MoEngage,2020,175000000,2021,125000000,2022,50000000,2023,150000000,NA,NA,Bangalore,Marketplace,"Raviteja Dodda, Yashwanth Kumar",Eight Roads Ventures,25000000,Series C,Customer analytics and cross-channel engagement platform,,,,,,,,,,,,,,,Classplus,2020,17500000,2021,12500000,2022,5000000,2023,15000000,NA,NA,Bangalore,EdtTech,"Rustagi, Bhaswat Agarwal","Blume Ventures, Sequoia",2500000,Pre series A,It allows coaching centres to take their brick-and-mortar setup online,,,,,,,,,,,,,,,Chaayos,2020,150500000,2021,107500000,2022,43000000,2023,129000000,NA,NA,Gurugram,Food & Beverages,"Nitin Saluja, Raghav Verma",Think Investment,21500000,,Provides customised range of tea,,,,,,,,,,,,,,,PetPooja,2020,14000000,2021,10000000,2022,4000000,2023,12000000,NA,NA,Gurugram,SaaS,Apurv Patel,Udaan,2000000,,Restaurant management software provider,,,,,,,,,,,,,,,Pepperfry,2020,280000000,2021,200000000,2022,80000000,2023,240000000,NA,NA,Bangalore,Marketplace,"Ambareesh Murty, Ashish Shah",Pidilite Industries,40000000,Series F,Online home furniture marketplace,,,,,,,,,,,,,,,FirstCry,2020,2072000000,2021,1480000000,2022,592000000,2023,1776000000,NA,NA,Bangalore,Marketplace,"Supam Maheshwari, Amitava Saha",Softbank?s Vision Fund,296000000,Series E,Baby products marketplace,,,,,,,,,,,,,,,Byju,2020,1400000000,2021,1000000000,2022,400000000,2023,1200000000,NA,NA,Mumbai,EdtTech,Byju Raveendran,General Atlantic,200000000,,Provides online learning classes,,,,,,,,,,,,,,,Waycool,2020,224000000,2021,160000000,2022,64000000,2023,192000000,NA,NA,Bangalore,AgriTech,Karthick Jayraman and Sanjay Dasari,LightBox Ventures,32000000,Series C,Food development and distribution services,,,,,,,,,,,,,,,WorkIndia,2020,42000000,2021,30000000,2022,12000000,2023,36000000,NA,NA,Bangalore,HR tech,Kunal Patil,Xiaomi,6000000,,An online and mobile-based platform that connects companies with blue collar employees.,,,,,,,,,,,,,,,Qyuki,2020,24500000,2021,17500000,2022,7000000,2023,21000000,NA,NA,Noida,Media,"AR Rahman, Shekhar Kapur",Info Edge Venture Fund,3500000,,Multi-channel broadcast network,,,,,,,,,,,,,,,Leap India,2020,210000000,2021,150000000,2022,60000000,2023,180000000,NA,NA,Chennai,AgriTech,Narain Karthikeyan.,Neev Fund,30000000,Series B,Agricultural warehousing and logistics company,,,,,,,,,,,,,,,Picxy,2020,1750000,2021,1250000,2022,500000,2023,1500000,NA,NA,Gurugram,Media,Jitendra Emmani,"FirstCheque, Angellist India, Aakrit Vaish, Ranjith Radhakrishnan",250000,,Stock photo industry,,,,,,,,,,,,,,,Krimanshi,2020,140000,2021,100000,2022,40000,2023,120000,NA,NA,Gurugram,AgriTech,Nikhil Bohra,Arunachal Pradesh Social Entrepreneurship Meet,20000,,Sustainable system to feed animals by valorizing food residues and surplus into highly nutritious feeds,,,,,,,,,,,,,,,Dot Pvt. Ltd,2020,56000000,2021,40000000,2022,16000000,2023,48000000,NA,NA,Bangalore,Fintech,Shailaz Nag,"PayU, Fosun RZ Capital",8000000,Seed Round,It provides digital transformation and commerce solutions to brick and mortar outlets,,,,,,,,,,,,,,,Kuku FM,2020,38500000,2021,27500000,2022,11000000,2023,33000000,NA,NA,Noida,Media,"Lal Chand Bisu, Vikas Goyal, Vinod Kumar Meena",Vertex Ventures,5500000,Series A,A podcast platform,,,,,,,,,,,,,,,SuperMoney,2020,7000000,2021,5000000,2022,2000000,2023,6000000,NA,NA,Bangalore,Fintech,Nikhil Banerjee,Unitus Ventures.,1000000,Pre series A,Provides financial tools for effective business making,,,,,,,,,,,,,,,Rebel Foods,2020,34300000,2021,24500000,2022,9800000,2023,29400000,NA,NA,Kolkata,FoodTech,"Jaydeep Barman, Kallol Bannerjee",Alteria Capital,4900000,,It runs internet kitchen,,,,,,,,,,,,,,,Fox Capital,2020,17500000,2021,12500000,2022,5000000,2023,15000000,NA,NA,Mumbai,Fintech,Rakesh Sharma,Institutional Investors,2500000,,Digital lending startup,,,,,,,,,,,,,,,Fleetx,2020,9816800,2021,7012000,2022,2804800,2023,8414400,NA,NA,Bangalore,SaaS,"Vineet Sharma, Abhay Jeet Gupta, Udbhav Rai, Parveen Kataria, Vishal Misra",Beenext,1402400,Series A,Fleet management and predictive analytics platform,,,,,,,,,,,,,,,Embibe,2020,88328100,2021,63091500,2022,25236600,2023,75709800,NA,NA,Bangalore,EdtTech,Aditi Avasthi,Reliance Industries Limited (RIL),12618300,,It provides AI-based data analytics to personalise learning outcomes,,,,,,,,,,,,,,,Entri,2020,9800000,2021,7000000,2022,2800000,2023,8400000,NA,NA,Mumbai,EdtTech,"Mohammed Hisamuddin, Rahul Ramesh",Good Capital,1400000,Seed Round,It is a app that provides different types of learning content in local languages,,,,,,,,,,,,,,,Oye! Rickshaw,2020,70000000,2021,50000000,2022,20000000,2023,60000000,NA,NA,Bangalore,Mobility,Akash Deep,Chiratae Ventures,10000000,Series A,App-based electric rickshaw hailing service,,,,,,,,,,,,,,,1MG,2020,69300000,2021,49500000,2022,19800000,2023,59400000,NA,NA,Mumbai,Health Care,"Prashant Tandon, Gaurav Agarwal, Vikas Chauhan",Bill & Melinda Gates Foundation,9900000,,Online pharmacy,,,,,,,,,,,,,,,Doubtnut,2020,105000000,2021,75000000,2022,30000000,2023,90000000,NA,NA,Bangalore,EdtTech,"Tanushri Nagori, Aditya Shankar",Tencent,15000000,Series A,Multi-lingual digital solutions platform for students,,,,,,,,,,,,,,,AdonMo,2020,21000000,2021,15000000,2022,6000000,2023,18000000,NA,NA,Mumbai,Advertisement,"Sandeep Bommireddi, Sravanth Gajula",Ant Financial,3000000,,It is an online and outdoor advertising company,,,,,,,,,,,,,,,BharatPe,2020,700000000,2021,500000000,2022,200000000,2023,600000000,NA,NA,Mumbai,Fintech,Ashneer Grover,Coatue Management,100000000,,Digital payments platform,,,,,,,,,,,,,,,Kisan Network,2020,21000000,2021,15000000,2022,6000000,2023,18000000,NA,NA,Bangalore,AgriTech,"Aditya Agarwalla, Sanjay Agarwalla",Atsushi Taira,3000000,Seed Round,Integrated supply chain for farmers to sell their produce directly to buyers,,,,,,,,,,,,,,,Vogo,2020,245000000,2021,175000000,2022,70000000,2023,210000000,NA,NA,Mumbai,Electric Vehicle,"Anand Ayyadurai, Padmanabhan Balakrishnan, Sanchit Mittal",Lightstone Aspada,35000000,Series C,A scooter-sharing platform allowing users to rent a two-wheeler from specific designated pick up points,,,,,,,,,,,,,,,Yolo,2020,4200000,2021,3000000,2022,1200000,2023,3600000,NA,NA,Bangalore,Transportation,"Shailesh Gupta, Mukul Shah, Danish Chopra",Undisclosed,600000,Seed Round,Intercity transportation startup,,,,,,,,,,,,,,,Unotech,2020,14000000,2021,10000000,2022,4000000,2023,12000000,NA,NA,New Delhi,SaaS,Vikash Jha,Manish Choksi,2000000,,It develops fully-customisable open source software,,,,,,,,,,,,,,,Zetwerk,2020,15400000,2021,11000000,2022,4400000,2023,13200000,NA,NA,Bangalore,Marketplace,"Amrit Acharya, Srinath Ramakkrushnan, Vishal Chaudhary",InnoVen capital,2200000,,B2B marketplace that connects manufacturing companies for industrial equipements,,,,,,,,,,,,,,,CureSkin,2020,3500000,2021,2500000,2022,1000000,2023,3000000,NA,NA,Bangalore,Health Care,"Guna Kakulapati, Rama Rajanna, Charu Sharma",SenseAI Ventures,500000,,Provides a treatment solution for skincare and hair fall issues with an artificial intelligence-enabled solution,,,,,,,,,,,,,,,WizKlub,2020,6877710,2021,4912650,2022,1965060,2023,5895180,NA,NA,Noida,EdtTech,Amit Bansal,Incubate Fund India,982530,Seed Funding,Helps students solve problems at complex level,,,,,,,,,,,,,,,Interviewbit,2020,1400000000,2021,1000000000,2022,400000000,2023,1200000000,NA,NA,Noida,EdtTech,Abhimanyu Saxena,"Tiger Global Management, Sequoia Capital India, Singapore?s Economic Development Board (EBD)",200000000,Series A,Platform that provides coding and interview preparation course by industry professionals from tech companies,,,,,,,,,,,,,,,MoneyTap,2020,491296400,2021,350926000,2022,140370400,2023,421111200,NA,NA,Bangalore,Fintech,"Bala Parthasarathy, Anuj Kacker, Kunal Varma","Aquiline Technology Growth (ATG), RTP Global, Sequoia India",70185200,Series B,App-based consumer credit line that gives customers access to credit on tap.,,,,,,,,,,,,,,,INdwealth,2020,84000000,2021,60000000,2022,24000000,2023,72000000,NA,NA,Bangalore,Fintech,Ashish Kashyap,"Tiger Global, Steadview Capital, DF International Private Partners",12000000,Series C,An Artificial Intelligence and Machine learning based wealth management platform,,,,,,,,,,,,,,,Bizongo,2020,210000000,2021,150000000,2022,60000000,2023,180000000,NA,NA,New Delhi,Marketplace,"Sachin Agarwal, Aniket Deb, Ankit Tomar",Schroder Adveq,30000000,Series C,A B2B marketplace for packaging materials,,,,,,,,,,,,,,,AppsFlyer,2020,1470000000,2021,1050000000,2022,420000000,2023,1260000000,NA,NA,Gurugram,SaaS,"Oren Kaniel, Reshef Mann",General Atlantic,210000000,Series D,Mobile marketing analytics and attribution platform,,,,,,,,,,,,,,,Digit Insurance,2020,588000000,2021,420000000,2022,168000000,2023,504000000,NA,NA,Mumbai,Insurtech,Kamesh Goyal,"A91 Partners, Faering Capital, TVS Capital",84000000,,General Insurance Company,,,,,,,,,,,,,,,Livspace,2020,420000000,2021,300000000,2022,120000000,2023,360000000,NA,NA,Bangalore,Home Decor,"Anuj Srivastava, Ramakant Sharma, Shagufta Anurag","Tahoe Investment Group, Mercer Investment",60000000,Series D,It offers end-to-end home design experience for homeowners and home designers,,,,,,,,,,,,,,,LogiNext,2020,273000000,2021,195000000,2022,78000000,2023,234000000,NA,NA,Mumbai,Electric Vehicle,"Dhruvil Sanghvi, Manisha Raisinghani","Tiger Global, Steadview Capital",39000000,Series B,"It helps logistics companies to improve internal operations, optimise delivery networks and provide customer service",,,,,,,,,,,,,,,Samosa Singh,2020,18900000,2021,13500000,2022,5400000,2023,16200000,NA,NA,Ambernath,FoodTech,"Shikhar Veer Singh, Nidhi Singh",She Capital,2700000,Series A,Offers hygienic Indian Snacks,,,,,,,,,,,,,,,Crysta,2020,9823800,2021,7017000,2022,2806800,2023,8420400,NA,NA,New Delhi,Health Care,,"Green Shots Capital, Alfa Ventures, Real Time Venture, Petrotech, Steel City Securities, Lalit Wadhwa, Dr Kriti Maroli",1403400,Pre Series A,Offers diagnostic and screening services with regular counselling and clinical data management,,,,,,,,,,,,,,,Eupheus Learning,2020,30100000,2021,21500000,2022,8600000,2023,25800000,NA,NA,Bangalore,EdtTech,"Sarvesh Shrivastava, Ved Prakash Khatri, Amit Kapoor",Yuj Ventures,4300000,Series A,"Provides technology-led, subscription-based learning solutions to schools",,,,,,,,,,,,,,,Bounce,2020,735000000,2021,525000000,2022,210000000,2023,630000000,NA,NA,Bangalore,Electric Vehicle,"Vivekananda Hallekere, Anil Giri Raju,Arun Agni","Accel Partners, B Capital",105000000,Series D,Offers a variety of bikes and scooters that can be rented on a subscription basis,,,,,,,,,,,,,,,Park+,2020,77000000,2021,55000000,2022,22000000,2023,66000000,NA,NA,Bangalore,Technology,Amit Lakhotia,"Sequoia Capital, Matrix Partners India",11000000,,It is engaged in bringing digitization in parking,,,,,,,,,,,,,,,SmartKarrot,2020,7000000,2021,5000000,2022,2000000,2023,6000000,NA,NA,New Delhi,SaaS,"Prithwi Dasgupta, Arnab Chatterjee",Angel investors,1000000,,It tracks customers? real-time digital behaviour,,,,,,,,,,,,,,,Skylo,2020,721000000,2021,515000000,2022,206000000,2023,618000000,NA,NA,Bangalore,Information Technology,Trivedi,SoftBank Group,103000000,Series B,Provides affordable and ever present network that connects machines or sensors,,,,,,,,,,,,,,,Tea Trunk,2020,1540000,2021,1100000,2022,440000,2023,1320000,NA,NA,Gurugram,Food & Beverages,"Snigdha Manchanda, Vikas Kumar, Aishwarya Malhi",Angel investors,220000,,Global premium tea brand,,,,,,,,,,,,,,,Zoomcar,2020,210000000,2021,150000000,2022,60000000,2023,180000000,NA,NA,New Delhi,Transportation,"Greg Moran, David Back",Sony Innovation Fund,30000000,Series D,A car rental service platform,,,,,,,,,,,,,,,Mera Cashier,2020,1750000,2021,1250000,2022,500000,2023,1500000,NA,NA,New Delhi,Fintech,"Suneel Kumar, Sucharita Reddy, Gaurav Tomar, Akhilesh Nigam,","Amit Singal, Manish Aggarwal",250000,Seed Round,App meant for small and micro businessmen to manage their transactions digitally,,,,,,,,,,,,,,,Samya AI,2020,42000000,2021,30000000,2022,12000000,2023,36000000,NA,NA,Hyderabad,SaaS,"Shailendra Singh, Deepinder Dhingra, Pavan Palety",Sequoia India,6000000,Seed Round,Revenue growth AI startup in the consumer packed goods (CPG) space,,,,,,,,,,,,,,,Kristal AI,2020,42000000,2021,30000000,2022,12000000,2023,36000000,NA,NA,New Delhi,Artificial Intelligence,"Asheesh Chanda, Vineeth Narasimhan",Chiratae Ventures,6000000,Series A,Provides Algorithm-based financial services,,,,,,,,,,,,,,,Invento Robotics,2020,1969100,2021,1406500,2022,562600,2023,1687800,NA,NA,Ahmadabad,Artificial Intelligence,"Balaji Viswanathan, Be Limitless Inc., Zingfin.com, NalandaU","Windrose Capital, ITI Growth Opportunities Venture Fund",281300,Seed Round,Known for Mitra Series of Robots,,,,,,,,,,,,,,,Medicus,2020,88900,2021,63500,2022,25400,2023,76200,NA,NA,Bangalore,Health Care,"Bhavesh Shah, Manav Shah",Angel investors,12700,,AI-based platform that explains and interprets blood tests and medical reports,,,,,,,,,,,,,,,Monech,2020,88900,2021,63500,2022,25400,2023,76200,NA,NA,Bangalore,Fintech,,Angel investors,12700,Seed Round,Automated platform which will help users to take their financial decisions,,,,,,,,,,,,,,,Teach Us,2020,88900,2021,63500,2022,25400,2023,76200,NA,NA,Bangalore,EdtTech,,Angel investors,12700,Seed Round,Educational portal which enables the students to access information related to education at one common platform,,,,,,,,,,,,,,,Phenom People,2020,210000000,2021,150000000,2022,60000000,2023,180000000,NA,NA,Bangalore,HR tech,Mahe Bayireddi,WestBridge Capital,30000000,Series C,It redefines the means to search for a job and recruit top talent,,,,,,,,,,,,,,,Extra Edge,2020,4900000,2021,3500000,2022,1400000,2023,4200000,NA,NA,Pune,EdtTech,Kavita Dhillon,"Sprout Venture Partners, Indian Angel Network",700000,Pre Series A,Admission Marketing Automation software for the education industry,,,,,,,,,,,,,,,Capital Quotient,2020,4200000,2021,3000000,2022,1200000,2023,3600000,NA,NA,New Delhi,Fintech,Sousthav Chakrabarty,Undisclosed,600000,,Investment advisor,,,,,,,,,,,,,,,Karfa,2020,175000,2021,125000,2022,50000,2023,150000,NA,NA,New Delhi,E-commerce,Kartikeya Goel,Undisclosed,25000,Seed Round,It sells products crafted by artisans,,,,,,,,,,,,,,,Gamerji,2020,2800000,2021,2000000,2022,800000,2023,2400000,NA,NA,Bangalore,Gaming,"Soham Thacker, Varun Gajjar",La Gajjar Group,400000,,Esports tournament platform,,,,,,,,,,,,,,,Bounce,2020,682500000,2021,487500000,2022,195000000,2023,585000000,NA,NA,Chennai,Electric Vehicle,"Vivekananda Hallekere, Anil Giri Raju,Arun Agni","Accel Partners, B Capital",97500000,Series D,Offers a variety of bikes and scooters that can be rented on a subscription basis,,,,,,,,,,,,,,,Zinier,2020,630000000,2021,450000000,2022,180000000,2023,540000000,NA,NA,Gurugram,Automation,Arka Dhar,ICONIQ Capital,90000000,Series C,Provides intelligent field service automation,,,,,,,,,,,,,,,Capital Float,2020,105000000,2021,75000000,2022,30000000,2023,90000000,NA,NA,Mumbai,Fintech,"Gaurav Hinduja, Sashank Rishyasringa","Sequoia Capital, Ribbit Capital, Amazon, Saif Partners",15000000,,Digital lending,,,,,,,,,,,,,,,Ninjacart,2020,70000000,2021,50000000,2022,20000000,2023,60000000,NA,NA,Mumbai,AgriTech,"Thirukumaran Nagarajan, Sharath Loganathan, Sachin Jose, Kartheeswaran KK, Vasudevan Chinnathambi","Flipkart India, Singapore-based GEC3",10000000,Series C,Online grocery delivery platform,,,,,,,,,,,,,,,TechnifyBiz,2020,14000000,2021,10000000,2022,4000000,2023,12000000,NA,NA,New Delhi,AgriTech,"Akash Sharma, Abhishek Agarwal","Omnivore, Insitor Impact Asia Fund",2000000,Seed Round,Online marketplace for non-perishable food items,,,,,,,,,,,,,,,Wysh,2020,14000000,2021,10000000,2022,4000000,2023,12000000,NA,NA,Bangalore,E-commerce,"Mahesh Gogineni, Varun MS, Manan Maheshwari",Kalaari Capital,2000000,Series A,Celebrity engagement and wishing platform,,,,,,,,,,,,,,,Keito,2020,1120000,2021,800000,2022,320000,2023,960000,NA,NA,New Delhi,Artificial Intelligence,Amal PS,Suma Soft Pvt Ltd,160000,Seed Round,Enterprise productivity startup,,,,,,,,,,,,,,,Klub,2020,14000000,2021,10000000,2022,4000000,2023,12000000,NA,NA,Bangalore,Fintech,"Anurakt Jain, Ishita Verma",Sequoia Surge,2000000,Pre seed round,Provides growth financing to high-affinity brands,,,,,,,,,,,,,,,Rheo,2020,14000000,2021,10000000,2022,4000000,2023,12000000,NA,NA,Panchkula,Entertainment,Gaurav Munjal,"Lightspeed Venture Partners, Sequoia Surge",2000000,,Online e-sports streaming and community platform,,,,,,,,,,,,,,,Axio Biosolutions,2020,36400000,2021,26000000,2022,10400000,2023,31200000,NA,NA,New Delhi,Pharmacy,Leo Mavely,Omidyar Network India,5200000,Series B,Medical device manufacturer,,,,,,,,,,,,,,,Techbooze,2020,105000000,2021,75000000,2022,30000000,2023,90000000,NA,NA,Bangalore,Consulting,Mr. Subhashis Kar,Space Capital,15000000,Series A,"Business Development, Consulting and Funding facilitator for Startups Enterprise",,,,,,,,,,,,,,,Testbook,2020,58800000,2021,42000000,2022,16800000,2023,50400000,NA,NA,Pune,EdtTech,"Praveen Agrawal, Yadvendar Champawat, Manoj Munna, Abhishek Sagar, Ashutosh Kumar, Narendra Agrawal",Iron Pillar,8400000,Series B,Helps students prepare online for competitive exams,,,,,,,,,,,,,,,