Company/Brand,Year1,Revenue1,Year2,Revenue2,Year3,Revenue3,Year4,Revenue4,Year5,Revenue5,HQ,Sector,Founders,Investor,Amount($),Stage,What it does,,,,,,,,,,,,,,,MyGlamm,2021,280000000,2022,200000000,2023,80000000,NA,NA,NA,NA,Mumbai,EdtTech,"Darpan Sanghvi, Priyanka Gill",Accel Partners,40000000,,MyGlamm is India?s fastest growing direct-to-consumer beauty brand.,,,,,,,,,,,,,,,Gumlet,2021,11200000,2022,8000000,2023,3200000,NA,NA,NA,NA,Ahmedabad,Information Technology,"Divyesh Patel, Aditya Patadia",Sequoia?s Surge,1600000,,Gumlet has built a new-age media delivery infrastructure that provides low code or no-code integration plugins that automate the entire media publishing pipeline.,,,,,,,,,,,,,,,Eloelo,2021,14000000,2022,10000000,2023,4000000,NA,NA,NA,NA,Bangalore,Gaming,"Saurabh Pandey, Akshay Dubey","Waterbridge, Lumikai",2000000,Pre-series A,Creator-led Social Gaming & Live Streaming Platform,,,,,,,,,,,,,,,Edukemy,2021,14000000,2022,10000000,2023,4000000,NA,NA,NA,NA,Noida,EdtTech,Chandrahas Panigrahi,"Auxano, Falcon5",2000000,Pre-series A,"Edukemy is the first EdTech company in the country, in the non ?STEM segment, offering an immersive learning experience to the students, supported by cutting-edge technology and an AI-based evaluation system.",,,,,,,,,,,,,,,Zingbus,2021,35000000,2022,25000000,2023,10000000,NA,NA,NA,NA,Mumbai,Mobility,"Mratunjay, Prashant Kumar, Ravi Kumar Verma",Infoedge ventures,5000000,Pre-series A,Zingbus is a renowned brand in the bus operating industry.,,,,,,,,,,,,,,,NewsReach,2021,2100000,2022,1500000,2023,600000,NA,NA,NA,NA,Hyderabad,Media,"Soniya Kundnani, Darshan Shah",JITO Angel Network,300000,Seed,NewsReach is a Mumbai based company that wants to create a disruptive ecosystem of original and local news content.,,,,,,,,,,,,,,,Pencilton,2021,2310000,2022,1650000,2023,660000,NA,NA,NA,NA,Gurugram,Fintech,"VishwajitPureti, Ashish Singh, Pallavi Tipparaju, Viraj Gadde",Jupiter,330000,Pre-seed,"India's first app for kids & teens to manage and spend pocket money while learning about money in a fun, gamified way.",,,,,,,,,,,,,,,Bandhoo,2021,7000000,2022,5000000,2023,2000000,NA,NA,NA,NA,Mumbai,Information Technology,"Prashant Gupta, Sridhar Sundaram",Unitus Ventures,1000000,,"Bringing ease of eCommerce to Construction for builders, infrastructure companies, contractors and workers",,,,,,,,,,,,,,,ixigo,2021,371000000,2022,265000000,2023,106000000,NA,NA,NA,NA,New Delhi,Information Technology,"Rajnish Kumar, Aloke Bajpai","GIC, Infoedge",53000000,,"AI-based travel app offering seamless planning and booking for flights, trains, buses, hotels and more!",,,,,,,,,,,,,,,The Whole Truth,2021,42000000,2022,30000000,2023,12000000,NA,NA,NA,NA,Mumbai,Food & Beverages,Shashank Mehta,Sequoia Capital,6000000,Series A,"Believe simple, homely ingredients, minimally processed, are the secret to nutritious, tasty food",,,,,,,,,,,,,,,Insane AI,2021,5600000,2022,4000000,2023,1600000,NA,NA,NA,NA,Mumbai,Fitness,"Anurag Mundhada, Jayesh Hannurkar, Sourabh Agrawal",pi Ventures,800000,Seed,Mainstream fitness formats are a primitive solution to the modern problems of a sedentary lifestyle.,,,,,,,,,,,,,,,Droom,2021,1400000000,2022,1000000000,2023,400000000,NA,NA,NA,NA,Mumbai,Electric Vehicle,Sandeep Aggarwal,,200000000,,"Droom is an AI and data science driven online transactional platform, which offers 21st century experience in buying & selling used & new automobiles in India",,,,,,,,,,,,,,,Go Swift,2021,14000000,2022,10000000,2023,4000000,NA,NA,NA,NA,Bangalore,Consumer Goods,"Shyam Kalita, Debanshu Sinha, Prayas Mittal",Kalaari Capital,2000000,Pre-series A,Help small & medium sized businesses to grow by helping them with their shipping requirements at the cheapest and most reliable service.,,,,,,,,,,,,,,,Mamaearth,2021,350000000,2022,250000000,2023,100000000,NA,NA,NA,NA,Jaipur,Health Care,"Varun Alagh, Ghazal Alagh",Sofina Ventures SA,50000000,,A brand which develops products from world-class research and attempts to solve every little problem that we as parents face.,,,,,,,,,,,,,,,G.O.A.T,2021,252000000,2022,180000000,2023,72000000,NA,NA,NA,NA,Noida,EdtTech,"Rishi Vasudev, Rameswar Misra","Tiger Global, Flipkart Ventures",36000000,Series A,G.O.A.T Brand Labs provides a tech-enabled platform for D2C brands to scale.,,,,,,,,,,,,,,,Knorish,2021,7000000,2022,5000000,2023,2000000,NA,NA,NA,NA,Bangalore,EdtTech,"Rakhi Wadhwa, Kinner N Sacchdev","Inflection Point Ventures, Rockstud Capital, Pentathlon Ventures, Prophetic Ventures syndicate",1000000,Pre-series A,"Saas platform offers a feature packed platform enables businesses, experts, professionals, artists, instructors, specialists, coaches, people seeking work from home opportunities",,,,,,,,,,,,,,,Dozee,2021,35000000,2022,25000000,2023,10000000,NA,NA,NA,NA,Bangalore,Health Care,"Mudit Dandwate, Dandwate",Prime VP,5000000,Series A,"Dozee is India's only contactless health monitor that silently tracks your heart, respiration, sleep patterns, stress levels, cardiac contractions, apnea and more while you sleep.",,,,,,,,,,,,,,,BlackBuck,2021,469000000,2022,335000000,2023,134000000,NA,NA,NA,NA,Bangalore,Logistics & Supply Chain,"B Ramasubramanian, Chanakya Hridaya, Rajesh Yabaji","Tribe Capital, IFC Emerging Asia Fund, VEF",67000000,Series E,BlackBuck marks the beginning of a new path in trucking. A path that is organized and makes trucking simple for every shipper and trucker.,,,,,,,,,,,,,,,Mailmodo,2021,14000000,2022,10000000,2023,4000000,NA,NA,NA,NA,Bangalore,Advertisement,"Aquibur Rahman, Apurv Gupta, Devyesh Tandon","Sequoia?s Surge, Y Combinator",2000000,Seed,Mailmodo is a complete email marketing solution enabling users to create and send app-like interactive emails to improve email conversions.,,,,,,,,,,,,,,,NirogStreet,2021,17500000,2022,12500000,2023,5000000,NA,NA,NA,NA,Noida,Health Care,Ram N Kumar,"Gokul Rajaram, Pureland Venture, Wavemaker Partners",2500000,Series A,Nirogstreet as a concept is working to make #Ayurveda first call of treatment.,,,,,,,,,,,,,,,Even,2021,35000000,2022,25000000,2023,10000000,NA,NA,NA,NA,New Delhi,Health Care,"Mayank Banerjee, Matilde Giglio, Alessandro Davide Ialongo",Khosla Ventures,5000000,Seed,One monthly subscription to cover all your healthcare needs.,,,,,,,,,,,,,,,Captain Fresh,2021,84000000,2022,60000000,2023,24000000,NA,NA,NA,NA,Pune,Logistics & Supply Chain,Utham Gowda,"Accel Partners, Matrix India",12000000,Series A,A B2B marketplace leveraging technology to deliver the fastest harvest-to-retail in the industry.,,,,,,,,,,,,,,,Otipy,2021,71400000,2022,51000000,2023,20400000,NA,NA,NA,NA,Bangalore,Food & Beverages,Varun Khurana,"Omidyar Network India, Innoven Capital",10200000,Series A,Otipy helps the farmer to deliver farm fresh vegetables & fruits at doorstep.,,,,,,,,,,,,,,,Eka.care,2021,31500000,2022,22500000,2023,9000000,NA,NA,NA,NA,Mumbai,Health Care,Vikalp Sahni,"Deep Kalra, Ashish Kashyap, Rajesh Magow",4500000,,A digitally enabled and connected healthcare ecosystem for better health outcomes.,,,,,,,,,,,,,,,Braingroom,2021,1400000,2022,1000000,2023,400000,NA,NA,NA,NA,Kochi,EdtTech,"Madhula Sathyamoorthy, Naliene Ramasamy, Kalaiarsi Periasamy","IAN, Social Alpha, Startup Oasis",200000,,"BrainGroom is an online marketplace for educational, recreational & wellness classes with defined target segment, quantifiable outcomes & specified time duration.",,,,,,,,,,,,,,,Edvizo,2021,7000000,2022,5000000,2023,2000000,NA,NA,NA,NA,Bangalore,Consumer Goods,Ravi Nishant,Inflection Point Ventures,1000000,Pre-series A,"Edvizo is an online marketplace to help students and parents find, compare and enroll in the best and trusted private institutes in their locality",,,,,,,,,,,,,,,Credenc,2021,175000000,2022,125000000,2023,50000000,NA,NA,NA,NA,Mumbai,Fintech,Avinash Kumar,Capital India,25000000,,An education loan platform to finance meritorious students for the college expenses by underwriting future employability,,,,,,,,,,,,,,,GlobalBees,2021,1050000000,2022,750000000,2023,300000000,NA,NA,NA,NA,Bangalore,EdtTech,Nitin Agarwal,"FirstCry, Lightspeed Venture Partners",150000000,Series A,Globalbees partners with entrepreneurs who have built an online-first business.  Our team scales up D2C businesses in India and abroad.,,,,,,,,,,,,,,,Spinny,2021,756000000,2022,540000000,2023,216000000,NA,NA,NA,NA,Bangalore,Electric Vehicle,"Niraj Singh, Mohit Gupta, Ramanshu Mahaur",Tiger Global,108000000,Series D,Spinny is a new age used car end-to-end platform in India.,,,,,,,,,,,,,,,Mynvax,2021,28000000,2022,20000000,2023,8000000,NA,NA,NA,NA,Mumbai,Biotechnology,"Dr Raghavan Varadarajan, Dr Gautham Nadig","Accel, LetsVenture, 1Crowd",4000000,Series A,Mynvax is a pre-clinical stage vaccine biotechnology. Current develop programs include a recombinant vaccine for human influenza and COVID19.,,,,,,,,,,,,,,,RiseBird,2021,3500000,2022,2500000,2023,1000000,NA,NA,NA,NA,Bangalore,HR tech,Ashutosh Seth,SAB Holdings,500000,,RiseBird provides on-demand 2.5K + expert video interviews and A.I. powered insights to help companies hire online.,,,,,,,,,,,,,,,Uvi Health,2021,2310000,2022,1650000,2023,660000,NA,NA,NA,NA,Pune,Health Care,Mehak Malik,Titan Capital,330000,Pre-seed,Digital health platform delivering personalized care for women?s sexual and reproductive health concerns,,,,,,,,,,,,,,,Vegrow,2021,91000000,2022,65000000,2023,26000000,NA,NA,NA,NA,London,AgriTech,"Praneeth Kumar, Shobhit Jain, Mrudhukar Batchu, Kiran Naik","Lightspeed Venture Partners, Elevation Capital",13000000,,Vegrow is in the business of fresh fruits & vegetables with addressable market size of $43 Billion.,,,,,,,,,,,,,,,Automovill,2021,3500000,2022,2500000,2023,1000000,NA,NA,NA,NA,Bangalore,Electric Vehicle,"Mridu Mahendra Das, Chinmay Baruah",Mumbai Angels Network,500000,,"Automovill is a unique platform to aggregate automobile service providers, where we connect vehicle owners with all kind of automobile service providers under one roof.",,,,,,,,,,,,,,,HealthifyMe,2021,525000000,2022,375000000,2023,150000000,NA,NA,NA,NA,Bangalore,Health Care,"Tushar Vashisht, Sachin Shenoy","LeapFrog, Khosla Ventures",75000000,Series C,HealthifyMe is a revolutionary health and fitness application that is on a mission to transform a billion lives!,,,,,,,,,,,,,,,GalaxyCard,2021,3150000,2022,2250000,2023,900000,NA,NA,NA,NA,Bangalore,Fintech,Amit Kumar,JITO Angel Network,450000,,GalaxyCard is a mobile based Instant Credit Card.,,,,,,,,,,,,,,,Bella Vita Organic,2021,70000000,2022,50000000,2023,20000000,NA,NA,NA,NA,Mumbai,Health Care,Aakash Anand,Ananta Capital,10000000,,Bella Vita Organic or ?The Good Life? is dedicated to creating handcrafted and organic beauty solutions inspired by the natural elements of the earth and age old beauty best practices.,,,,,,,,,,,,,,,SmartCoin,2021,70000000,2022,50000000,2023,20000000,NA,NA,NA,NA,Bangalore,Fintech,"Jayant Upadhyay, Amit Chandel, Rohit Garg","Northern Arc, Vivriti Capital",10000000,,India's Most Preferred Instant Loan App,,,,,,,,,,,,,,,Sea6 Energy,2021,63000000,2022,45000000,2023,18000000,NA,NA,NA,NA,Hyderabad,Biotechnology,"Sailaja Nori, Nelson Vadassery, Sowmya Balendiran, Shrikumar Suryanarayan",Aqua-Spark,9000000,Series B,"Sea6 Energy envisions a future where the abundant oceans will be our biomass farms of tomorrow - to provide solutions in energy, agriculture and food.",,,,,,,,,,,,,,,Beco,2021,3500000,2022,2500000,2023,1000000,NA,NA,NA,NA,Bangalore,Consumer Goods,"Aditya Ruia, Akshay Varma, Anuj Ruia",Climate Angels Fund,500000,Seed,"Eco-friendly home and kitchen care products that are plastic-free, high in quality and affordable.",,,,,,,,,,,,,,,OneCode,2021,35000000,2022,25000000,2023,10000000,NA,NA,NA,NA,Bangalore,Internet,"Manish Shara, Yash Desai","Sequoia?s Surge, Nexus Venture Partners",5000000,,"OneCode is a platform which connects new age digital first brands with ""relevant"" sellers (aka OneCoders) to sell their products and services",,,,,,,,,,,,,,,MedPay,2021,8400000,2022,6000000,2023,2400000,NA,NA,NA,NA,Gurugram,Information Technology,"Arun Bhatia, Ravi Chandra","Entrepreneur First (EF), GrowX Ventures",1200000,Seed,MedPay? is building the real-time claims adjudication platform for health insurers.,,,,,,,,,,,,,,,Inshorts,2021,420000000,2022,300000000,2023,120000000,NA,NA,NA,NA,Bangalore,Internet,Azhar Iqubal,Vy Capital,60000000,,Built Inshorts with a promise to deliver news,,,,,,,,,,,,,,,Aqgromalin,2021,4900000,2022,3500000,2023,1400000,NA,NA,NA,NA,Chennai,AgriTech,"Prasanna Manogaran, Bharani CL",Zephyr Peacock,700000,Seed,Aqgormalin is a tech driven farm diversification platform enabling farmers to diversify into Animal Husbandry and Aquaculture.,,,,,,,,,,,,,,,Square Yards,2021,175000000,2022,125000000,2023,50000000,NA,NA,NA,NA,Bangalore,Real Estate,Tanuj Shori,ADM Capital,25000000,,India?s largest tech enabled Real Estate Brokerage and Mortgage Marketplace,,,,,,,,,,,,,,,OYO,2021,4620000000,2022,3300000000,2023,1320000000,NA,NA,NA,NA,Mumbai,Hospitality,Ritesh Agarwal,"SoftBank Vision Fund, Hindustan Media Venture",660000000,,OYO is a global platform that empowers entrepreneurs and small businesses with hotels and homes by providing full-stack technology,,,,,,,,,,,,,,,Ola Electric,2021,700000000,2022,500000000,2023,200000000,NA,NA,NA,NA,Chennai,Electric Vehicle,Bhavish Aggarwal,Bank of Baroda,100000000,Debt,Ola Electric - The future of mobility is here.? Charging ahead to accelerate the world?s transition to sustainable mobility.,,,,,,,,,,,,,,,Bikry app,2021,9100000,2022,6500000,2023,2600000,NA,NA,NA,NA,The Nilgiris,Consumer Goods,Abhishek Bhayana,YCombinator,1300000,,"Bikry, a Direct-to-Customer platform to start your online store within 30 seconds at 0% commission",,,,,,,,,,,,,,,Oliveboard,2021,21000000,2022,15000000,2023,6000000,NA,NA,NA,NA,Pune,EdtTech,"Abhishek Patil, V Satish Kumar",IAN Fund,3000000,,Oliveboard is the top exam preparation platform for Banking & Government Exams.,,,,,,,,,,,,,,,Kredent,2021,7000000,2022,5000000,2023,2000000,NA,NA,NA,NA,Gurugram,EdtTech,"Vineet Patawari, Vivek Bajaj, Vinay Pagaria",Kotak Securities,1000000,,Kredent Academy is the unique concept where financial market professionals have taken the onus of creating a strong knowledge bank in their area of expertise,,,,,,,,,,,,,,,EasyAspataal,2021,3500000,2022,2500000,2023,1000000,NA,NA,NA,NA,Bangalore,Health Care,"Manoj Gupta, Gunjali Kothari",Venture Catalysts,500000,Seed,India?s First Digital Admission Desk for Hospitalisation.,,,,,,,,,,,,,,,Arcana,2021,2590000,2022,1850000,2023,740000,NA,NA,NA,NA,Gurugram,Information Technology,"Mayur Relekar, Aravindh Kumar, Abhishek Chaudhary",Balaji Srinivasan,370000,Seed,Arcana is the Storage Layer of Ethereum.,,,,,,,,,,,,,,,Vah Vah!,2021,12600000,2022,9000000,2023,3600000,NA,NA,NA,NA,Bangalore,EdtTech,"Shailesh Daxini, Akash Senapaty, Muthukaleeshwaran Subbiah",Sequoia Surge,1800000,,A mission to educate India and make its young and dynamic population job ready.,,,,,,,,,,,,,,,Sapio Analytics,2021,1050000,2022,750000,2023,300000,NA,NA,NA,NA,New Delhi,Computer software,"Ashwin Srivastava, Hardik Somani, Prashant Nikam",Parthiv Group,150000,,Aim to provide the most intelligent AI-powered policy making solutions for government institutions across the world.,,,,,,,,,,,,,,,Ati Motors,2021,245000000,2022,175000000,2023,70000000,NA,NA,NA,NA,Pune,Electric Vehicle,"Saurabh Chandra, Saad Nasser","Blume Ventures, Exfinity Venture Partners",35000000,Pre-series A,Autonomous industrial vehicle maker,,,,,,,,,,,,,,,peAR,2021,2100000,2022,1500000,2023,600000,NA,NA,NA,NA,Gandhinagar,Deeptech,"Dharmin Vora, Dhruvesh Mehta, Parth Vora",Inflection Point Ventures,300000,Pre-series A1,An AR / VR tech based Start-up in Mumbai.,,,,,,,,,,,,,,,Gourmet Garden,2021,21000000,2022,15000000,2023,6000000,NA,NA,NA,NA,Bangalore,AgriTech,Arjun Balaji,"Beyond Next Ventures, M Venture Partners",3000000,,"100% contamination free, pesticide free naturoponically grown vegetables.",,,,,,,,,,,,,,,The Sleep Company,2021,7000000,2022,5000000,2023,2000000,NA,NA,NA,NA,Mumbai,Consumer Goods,,Fireside Ventures,1000000,Pre-series A,Patent Pending sleep technology developed by actual Rocket Scientists and sleep experts after years of research.,,,,,,,,,,,,,,,ION Energy,2021,25200000,2022,18000000,2023,7200000,NA,NA,NA,NA,Mumbai,Electric Vehicle,Akhil Aryan,,3600000,Pre-series A,Advanced Electronics & Software Supplier for Electric Vehicles & Battery Energy Storage,,,,,,,,,,,,,,,Digit Insurance,2021,1400000000,2022,1000000000,2023,400000000,NA,NA,NA,NA,Bangalore,Insurtech,Kamesh Goyal,"Faering Capital, Sequoia Capital India, IIFL Alternate Asset Managers",200000000,,"Digit becomes the first Unicorn of 2021, valued at $1.9B.",,,,,,,,,,,,,,,FRAAZO,2021,77000000,2022,55000000,2023,22000000,NA,NA,NA,NA,Mumbai,Food & Beverages,"Atul Kumar, Aashish Krishnatre","Sixth Sense Ventures, NABVENTURES",11000000,Series A,FRAAZO is Mumbai's favourite App for Fresh Vegetables and Fruits coming straight from the Farm to your Doorstep within 18 Hours.,,,,,,,,,,,,,,,Licious,2021,1344000000,2022,960000000,2023,384000000,NA,NA,NA,NA,Bangalore,Food & Beverages,"Abhay Hanjura, Vivek Gupta","Temasek, Multiples PE",192000000,Series F,"Licious is a consumer food company, focussed at delighting the world with an unmatched range of meat & meat products.",,,,,,,,,,,,,,,WinZO,2021,455000000,2022,325000000,2023,130000000,NA,NA,NA,NA,New Delhi,Gaming,Paavan Nanda,Griffin Gaming Partners,65000000,Series C,WinZO is the largest social gaming and entertainment platform in India.,,,,,,,,,,,,,,,Furlenco,2021,700000000,2022,500000000,2023,200000000,NA,NA,NA,NA,Bangalore,Consumer Goods,Ajith Mohan Karimpana,Zinnia Global,100000000,,Furlenco is a different furniture company.,,,,,,,,,,,,,,,TWID,2021,17500000,2022,12500000,2023,5000000,NA,NA,NA,NA,Bangalore,Fintech,"Amit Sharma, Amit Koshal, Rishi Batra","BEENEXT, Sequoia?s Surge",2500000,,"TWID is shaping the future of Digital Currencies, delivering new-age fintech solutions",,,,,,,,,,,,,,,MyMobiForce,2021,9800000,2022,7000000,2023,2800000,NA,NA,NA,NA,Noida,Internet,"Dheeraj Khatter, Himanshu Kumar, Kshitiz Saini",Bharat Inclusion,1400000,Pre-series A,"Crowdsourcing platform imparting best-in-class services with immensely talented, skilled & qualified workforce pan-India",,,,,,,,,,,,,,,Pine Labs,2021,4200000,2022,3000000,2023,1200000,NA,NA,NA,NA,Noida,Information Technology,Amrish Rau,"Fidelity, BlackRock",600000,,A merchant platform company that provides financing and last-mile retail transaction technology to merchants,,,,,,,,,,,,,,,Genworks Health,2021,14000000,2022,10000000,2023,4000000,NA,NA,NA,NA,Bangalore,Health Care,S Ganeshprasad,Blacksoil,2000000,,GENWORKS Health is an initiative by GE for empowering healthcare professionals operating in the rural areas to deliver better medical facilities and diagnostics while keeping things affordable.,,,,,,,,,,,,,,,Neverinstall,2021,2590000,2022,1850000,2023,740000,NA,NA,NA,NA,Bangalore,Information Technology,"Lakshmana Pasala, Ram Pasala",Speciale Invest,370000,Seed,A cloud platform to bring any GUI application regardless of OS and Device type to the browser.,,,,,,,,,,,,,,,BeatO,2021,35000000,2022,25000000,2023,10000000,NA,NA,NA,NA,New Delhi,Health Care,Gautam Chopra,W Health Ventures,5000000,Pre-series B,ULTIMATE app to manage chronic conditions.,,,,,,,,,,,,,,,Earth Rhythm,2021,8400000,2022,6000000,2023,2400000,NA,NA,NA,NA,Gurugram,Cosmetics,Harini Sivakumar,Anicut Angel Fund,1200000,Seed,A mission to make customers healthier and Earth a little greener.,,,,,,,,,,,,,,,Fountain9,2021,13300000,2022,9500000,2023,3800000,NA,NA,NA,NA,Mumbai,Computer software,"Niki Khokale, Rajas Lonkar","021 Capital, Y Combinator",1900000,Seed,"Fountain9 is a Y Combinator backed company, which offers predictive inventory planning and optimization software for e-commerce, DTC and retail companies.",,,,,,,,,,,,,,,Rockclimber,2021,7000000,2022,5000000,2023,2000000,NA,NA,NA,NA,Bangalore,Food & Beverages,"Deepak Poduval, Hariprasad Shetty",Anand Prakash Sharma,1000000,,RockClimber is a new age beverage brand with a portfolio of alcoholic and non alcoholic drinks.,,,,,,,,,,,,,,,SpEd@home,2021,2100000,2022,1500000,2023,600000,NA,NA,NA,NA,Mumbai,EdtTech,Dhaval Mody,,300000,,"Provide Remediation, Occupational Therapy, Speech Therapy and Socio-emotional coaching for children with Learning Disabilities like Dyslexia, Dysgraphia, Dyscalculia",,,,,,,,,,,,,,,Green Soul,2021,1400000,2022,1000000,2023,400000,NA,NA,NA,NA,Ambernath,Consumer Goods,Ravi Khushwani,velocity.in,200000,,Green Soul is No.1 brand on Amazon India in Ergonomic chairs category in terms of customer reviews.,,,,,,,,,,,,,,,Shiprocket,2021,287000000,2022,205000000,2023,82000000,NA,NA,NA,NA,New Delhi,Logistics & Supply Chain,"Saahil Goel, Akshay Ghulati","March Capital, Tribe Capital",41000000,Series D1,India's #1 eCommerce Logistics and Shipping Solution Empowering over 1 Lakh Indian eCommerce Sellers.,,,,,,,,,,,,,,,DealShare,2021,1008000000,2022,720000000,2023,288000000,NA,NA,NA,NA,Bangalore,Retail,"Rajat Shikhar, Vineet Rao, Sourjyendu Medda",Tiger Global,144000000,,The next generation disruptive (social) e-commerce product for the masses.,,,,,,,,,,,,,,,Teachmint,2021,140000000,2022,100000000,2023,40000000,NA,NA,NA,NA,Bangalore,EdtTech,"Mihir Gupta, Payoj Jain, Divyansh Bordia, Anshuman Kumar",Learn Capital,20000000,Pre-series B,Teachmint is an all-in-one education technology platform created specifically for the tutors of the digital age.,,,,,,,,,,,,,,,Vahak,2021,35000000,2022,25000000,2023,10000000,NA,NA,NA,NA,Bangalore,Transportation,"Vikas Chandrawat, Karan Shaha",RTP Global,5000000,Pre-series A,Building India's Largest & Most Trusted Online Transport Marketplace & Directory,,,,,,,,,,,,,,,goSTOPS,2021,7000000,2022,5000000,2023,2000000,NA,NA,NA,NA,New Delhi,Hospitality,"Pallavi Agarwal, Pankaj Parwanda","IAN, Yuj Ventures",1000000,Pre-series A,goSTOPS aims to be India?s biggest and most loved backpacker hostel brand.,,,,,,,,,,,,,,,Powerplay,2021,36400000,2022,26000000,2023,10400000,NA,NA,NA,NA,Bangalore,Construction,"Shubham Goyal, Lesh Dixit","Sequoia?s Surge, Accel Partners",5200000,,Powerplay helps simplify end to end Construction and Architecture project management.,,,,,,,,,,,,,,,Delhivery,2021,1890000000,2022,1350000000,2023,540000000,NA,NA,NA,NA,Gurugram,Logistics & Supply Chain,"Bhavesh Manglani, Kapil Bharati, Mohit Tandon, Sahil Barua, Suraj Saharan","Fidelity, GIC",270000000,Series H,"Delhivery is a supply chain services company that provides transportation, warehousing, freight, and order fulfillment services.",,,,,,,,,,,,,,,Avishkaar,2021,4200000,2022,3000000,2023,1200000,NA,NA,NA,NA,New Delhi,EdtTech,"Rajeev Gaba, Tarun Bhalla",Auxano,600000,Pre-series A,India's leading Ed-Tech startup spearheading the Maker Revolution in the sub-continent,,,,,,,,,,,,,,,Breathe Well-being,2021,7000000,2022,5000000,2023,2000000,NA,NA,NA,NA,New Delhi,Health Care,"Aditya Kaicker, Rohan Verma","Stanford Angels and Entrepreneurs India, Anjali Bansal",1000000,Pre-series A,Breathe Wellbeing is an interactive and personalized platform that helps organization increase employee engagement and productivity.,,,,,,,,,,,,,,,Good Health Clinic,2021,35000000,2022,25000000,2023,10000000,NA,NA,NA,NA,Hyderabad,Health Care,Samarth Sindhi,Khosla Ventures,5000000,,Full Stack Digital Health Clinic,,,,,,,,,,,,,,,Urban Company,2021,1750000000,2022,1250000000,2023,500000000,NA,NA,NA,NA,New Delhi,Home Decor,"Abhiraj Singh Bhal, Raghav Chandra, Varun Khaitan","Vy Capital, Wellington Management",250000000,Series F,Urban Company is an India-based company providing a marketplace for freelance labor.,,,,,,,,,,,,,,,MYBYK,2021,7000000,2022,5000000,2023,2000000,NA,NA,NA,NA,Ahmadabad,Rental,Arjit Soni,Avon Cycles,1000000,Pre-series A,MYBYK is an app that provides premium bicycle sharing and rental service.,,,,,,,,,,,,,,,Locus,2021,350000000,2022,250000000,2023,100000000,NA,NA,NA,NA,Bangalore,Logistics & Supply Chain,"Geet Garg, Nishith Rastogi","Blume Ventures, Exfinity Venture Partners",50000000,Series C,Locus is an intelligent decision-making and automation platform for logistics.,,,,,,,,,,,,,,,Crejo.Fun,2021,21000000,2022,15000000,2023,6000000,NA,NA,NA,NA,Bangalore,EdtTech,Vikas Bansal,"Matrix Partners India, 021 Capital",3000000,Seed,Crejo.Fun is a digital extracurricular learning platform being built with an intent to help children discover their passions and interests through creative learning.,,,,,,,,,,,,,,,Bambinos,2021,3500000,2022,2500000,2023,1000000,NA,NA,NA,NA,Bangalore,EdtTech,"Ashish Gupta, Ankit Hetamsaria","HNIs, Angels",500000,Seed,Cohort based extracurricular course for kids,,,,,,,,,,,,,,,KreditBee,2021,56000000,2022,40000000,2023,16000000,NA,NA,NA,NA,Bangalore,Fintech,"Karthikeyan Krishnaswamy, Madhusudan Ekambaram, Wan Hong","NewQuest Capital Partners, Motilal Oswal Private Equity",8000000,,KreditBee is a digital lending platform developed to assist young professionals with their personal finances.,,,,,,,,,,,,,,,Spardha,2021,2800000,2022,2000000,2023,800000,NA,NA,NA,NA,Pune,EdtTech,"Saurabh Srivastav, Amrita Srivastav",Inflection Point Ventures,400000,Pre-series A1,"Spardha School Of Music, Spardha Academy, Spardha Online are associated marks with Spardha Learnings Private Limited.",,,,,,,,,,,,,,,Holisol,2021,21000000,2022,15000000,2023,6000000,NA,NA,NA,NA,New Delhi,Logistics & Supply Chain,"Manish Ahuja, Naveen Rawat, Rahul Dogar","BlackSoil, CLSA Capital Partners",3000000,,HoliSol Logistics Is a Supply Chain Operations Company!,,,,,,,,,,,,,,,Now&Me,2021,7000000,2022,5000000,2023,2000000,NA,NA,NA,NA,New Delhi,Health Care,"Bani Singh, Drishti Gupta","Saama, Whiteboard Capital",1000000,,"Now&Me is a safe cocoon in the form of discussion forums, for you to let out your most intimate thoughts.",,,,,,,,,,,,,,,